provider,ticker,published_utc,headline,summary,url_redirect,image_url,source,url_final,url_canonical,url_original,domain,http_status,error
finnhub,META,2025-10-13T23:20:00,Realizing the Open Data Center Ecosystem Vision,"Today, the Open Compute Project Foundation (OCP), the nonprofit international organization bringing at-scale innovations and hyperscale best practices to all, announces an expansion to its Open Systems for AI, an umbrella initiative with the new Open Data Center for AI Strategic Initiative (SI), to increase efforts on key data center infrastructure challenges: power, cooling, mechanical, and management telemetry. The addition of this new strategic initiative is in response to a large increase in",https://finnhub.io/api/news?id=06060f1b79b1b7690623bd1144509061f6d96265cab9fb99075e22b829612176,https://s.yimg.com/rz/stage/p/yahoo_finance_en-US_h_p_finance_2.png,Yahoo,https://finance.yahoo.com/news/realizing-open-data-center-ecosystem-232000069.html,https://finance.yahoo.com/news/realizing-open-data-center-ecosystem-232000069.html,https://finance.yahoo.com/news/realizing-open-data-center-ecosystem-232000069.html,yahoo.com,200,
finnhub,META,2025-10-13T22:30:50,Nvidia DGX Spark hits market as 'world’s smallest AI supercomputer',"Nvidia's tiniest supercomputer officially hits the market on Wednesday. The DGX Spark, which Nvidia says offers data center-class performance, packs the company's GB10 Grace Blackwell superchip, as well as its ConnectX-7 networking capabilities and software stack.",https://finnhub.io/api/news?id=9573195703c949584965b1c26bf7fb2ed69e863a840498f262af83deef2accc3,https://s.yimg.com/rz/stage/p/yahoo_finance_en-US_h_p_finance_2.png,Yahoo,https://finance.yahoo.com/news/nvidia-dgx-spark-hits-market-as-worlds-smallest-ai-supercomputer-223050200.html,https://finance.yahoo.com/news/nvidia-dgx-spark-hits-market-as-worlds-smallest-ai-supercomputer-223050200.html,https://finance.yahoo.com/news/nvidia-dgx-spark-hits-market-as-worlds-smallest-ai-supercomputer-223050200.html,yahoo.com,200,
finnhub,META,2025-10-13T20:41:58,Why Nvidia (NVDA) Stock Is Trading Up Today,"Shares of leading designer of graphics chips Nvidia (NASDAQ:NVDA) jumped 2.6% in the afternoon session after President Donald Trump softened his stance on China tariffs, which boosted technology stocks, and the company made several announcements regarding new partnerships and product adoption for its AI data centers. The easing of trade tensions was particularly beneficial for chipmakers like Nvidia, as China represented a critical market for its data center products.",https://finnhub.io/api/news?id=6db9a05bd680f03ce4e67c0434c5780c1fdb5309b970c8adc740ea1a6485dc65,https://s.yimg.com/rz/stage/p/yahoo_finance_en-US_h_p_finance_2.png,Yahoo,https://finance.yahoo.com/news/why-nvidia-nvda-stock-trading-204158121.html,https://finance.yahoo.com/news/why-nvidia-nvda-stock-trading-204158121.html,https://finance.yahoo.com/news/why-nvidia-nvda-stock-trading-204158121.html,yahoo.com,200,
finnhub,META,2025-10-13T19:08:27,Meta Platforms Gets Buy Rating Reaffirmed from Citi,"Citi keeps $915 price target, adds 90-day upside catalyst watch",https://finnhub.io/api/news?id=7648f0898defb8d0ad4c8cfa5d1a42edbfa7d4fac783f5f2ce5ecd71305e4280,https://s.yimg.com/rz/stage/p/yahoo_finance_en-US_h_p_finance_2.png,Yahoo,https://finance.yahoo.com/news/meta-platforms-gets-buy-rating-190827128.html,https://finance.yahoo.com/news/meta-platforms-gets-buy-rating-190827128.html,https://finance.yahoo.com/news/meta-platforms-gets-buy-rating-190827128.html,yahoo.com,200,
finnhub,META,2025-10-13T17:55:47,Luffa Appoints Esra Ozturk as Head of Product to Lead the Next Era of Fan Loyalty Innovation,"LONDON - October 13, 2025 (NEWMEDIAWIRE) - Luffa, a decentralized messaging platform built for the fan economy, today announced the appointment of Esra Ozturk as its new Head of Product. Designed with end-to-end encryption and creator-first privacy, ...",https://finnhub.io/api/news?id=7b18f956d9a64f0ccf8142c39c8911977aca47921c8aab86c8335b87ade5d968,https://s.yimg.com/rz/stage/p/yahoo_finance_en-US_h_p_finance_2.png,Yahoo,https://finance.yahoo.com/news/luffa-appoints-esra-ozturk-head-175547255.html,https://finance.yahoo.com/news/luffa-appoints-esra-ozturk-head-175547255.html,https://finance.yahoo.com/news/luffa-appoints-esra-ozturk-head-175547255.html,yahoo.com,200,
finnhub,META,2025-10-13T16:44:22,"South Koreans Poured $1.24B Into US Tech, Crypto During the Korean Thanksgiving","South Korean investors turned their Chuseok holiday into a week of aggressive risk-taking, funneling $1.24 billion into US tech and crypto-linked assets while domestic markets were closed between October 3 and 9. Key Takeaways: South Korean investors poured $1.24 billion into US tech and crypto-linked assets during the Chuseok holiday ...",https://finnhub.io/api/news?id=6b79246831444211ec34ea9904e9fcfdaacce6581373d2985c2686feaf333c62,https://s.yimg.com/rz/stage/p/yahoo_finance_en-US_h_p_finance_2.png,Yahoo,https://cryptonews.com/news/south-koreans-poured-1-24b-into-us-tech-crypto-during-the-korean-thanksgiving/,https://cryptonews.com/news/south-koreans-poured-1-24b-into-us-tech-crypto-during-the-korean-thanksgiving/,https://cryptonews.com/news/south-koreans-poured-1-24b-into-us-tech-crypto-during-the-korean-thanksgiving/,cryptonews.com,200,
finnhub,META,2025-10-13T16:32:00,Taiwan Semi (TSM) is Going to $400,Top semi foundry is the backbone of the AI economy and makes NVIDIA magic possible,https://finnhub.io/api/news?id=7cda01ce291c04ffe400dee8881c3f7d2ee6177e0f0175cbf7427afb966c3247,https://s.yimg.com/rz/stage/p/yahoo_finance_en-US_h_p_finance_2.png,Yahoo,https://finance.yahoo.com/news/taiwan-semi-tsm-going-400-163200307.html,https://finance.yahoo.com/news/taiwan-semi-tsm-going-400-163200307.html,https://finance.yahoo.com/news/taiwan-semi-tsm-going-400-163200307.html,yahoo.com,200,
finnhub,META,2025-10-13T16:20:09,Risk Is Back On After Trump’s Latest China Post. Consumer Staples Are Struggling.,"President Donald Trump’s social media post gave Wall Street a green light to pile back into risk.  The Nasdaq Composite surged 2.1% on Monday after falling 3.6% on Monday.  The president told his Truth Social followers, “Don’t worry about China,” and Wall Street took him up on that.",https://finnhub.io/api/news?id=ae5db51f63db72ce6797c27231b4050a3d08fead6c287060a878cdc498c26570,https://s.yimg.com/rz/stage/p/yahoo_finance_en-US_h_p_finance_2.png,Yahoo,https://finance.yahoo.com/m/ea5672ff-53b5-341c-b452-9ab6f1c97a82/risk-is-back-on-after-trump%E2%80%99s.html,https://finance.yahoo.com/m/ea5672ff-53b5-341c-b452-9ab6f1c97a82/risk-is-back-on-after-trump%E2%80%99s.html,https://finance.yahoo.com/m/ea5672ff-53b5-341c-b452-9ab6f1c97a82/risk-is-back-on-after-trump%E2%80%99s.html,yahoo.com,200,
finnhub,META,2025-10-13T15:00:00,NVIDIA Spectrum-X Ethernet Switches Speed Up Networks for Meta and Oracle,"Hyperscalers Broaden Adoption of NVIDIA Networking Solutions to Drive Giga-Scale AI Data Center Performance NVIDIA Spectrum-X Ethernet Meta and Oracle will boost their AI data center networks with NVIDIA Spectrum-X Ethernet networking switches. News Summary: Meta to introduce switches built on NVIDIA Spectrum Ethernet for its Facebook Open Switching System platform. Oracle to build giga-scale AI supercomputers with Spectrum-X Ethernet switches. SAN JOSE, Calif., Oct. 13, 2025 (GLOBE NEWSWIRE) --",https://finnhub.io/api/news?id=11701dc93fd1db703e24fe85843f9f76d6d32d4bf3466e1629f00e6c8b7b3ca4,https://s.yimg.com/rz/stage/p/yahoo_finance_en-US_h_p_finance_2.png,Yahoo,https://finance.yahoo.com/news/nvidia-spectrum-x-ethernet-switches-150000369.html,https://finance.yahoo.com/news/nvidia-spectrum-x-ethernet-switches-150000369.html,https://finance.yahoo.com/news/nvidia-spectrum-x-ethernet-switches-150000369.html,yahoo.com,200,
finnhub,META,2025-10-13T13:54:46,"Factbox-From OpenAI to Meta, firms channel billions into AI infrastructure as demand booms","The companies said OpenAI would design the chips, which Broadcom will develop and deploy starting in the second half of 2026.  AMD agreed to supply artificial intelligence chips to OpenAI in a multi-year deal that would also give the ChatGPT creator the option to buy up to roughly 10% of the chipmaker.  Nvidia is set to invest up to $100 billion in OpenAI and supply it with data center chips, in a deal giving the chipmaker a financial stake in OpenAI.",https://finnhub.io/api/news?id=e91d5479bdde79457adc52dc6440213c47c6c611985d3bf33b373e42c4913b6b,https://s.yimg.com/rz/stage/p/yahoo_finance_en-US_h_p_finance_2.png,Yahoo,https://finance.yahoo.com/news/factbox-openai-meta-firms-channel-135446827.html,https://finance.yahoo.com/news/factbox-openai-meta-firms-channel-135446827.html,https://finance.yahoo.com/news/factbox-openai-meta-firms-channel-135446827.html,yahoo.com,200,
finnhub,META,2025-10-13T13:43:46,"Cantor Fitzgerald Keeps Overweight Rating on CoreWeave (CRWV), $174 PT","CoreWeave, Inc. (NASDAQ:CRWV) is one of the best performing NASDAQ stocks according to hedge funds. On October 6, Cantor Fitzgerald maintained its Overweight rating for CoreWeave and kept its $174 price target. The firm continues to be positive on CoreWeave due to its strong momentum, particularly following its partnership with Meta (Facebook’s parent company). Cantor […]",https://finnhub.io/api/news?id=7b0f6ee4cdc98fba56f35436adc441116ca1b4030d7a532e7d68145d4ec44257,https://s.yimg.com/rz/stage/p/yahoo_finance_en-US_h_p_finance_2.png,Yahoo,https://finance.yahoo.com/news/cantor-fitzgerald-keeps-overweight-rating-134346725.html,https://finance.yahoo.com/news/cantor-fitzgerald-keeps-overweight-rating-134346725.html,https://finance.yahoo.com/news/cantor-fitzgerald-keeps-overweight-rating-134346725.html,yahoo.com,200,
finnhub,META,2025-10-13T13:43:30,Broadcom (AVGO) Hits Key Milestone in Co-Packaged Optics Technology,"Broadcom Inc. (NASDAQ:AVGO) is one of the best performing NASDAQ stocks according to hedge funds. On October 1, the company announced the achievement of industry-leading quality and readability of Co-Packaged Optics (CPO). Broadcom achieved one million cumulative 400G equivalent port device hours of “flap-free” operation for its CPO technology, specifically in partnership with Meta. The […]",https://finnhub.io/api/news?id=321849715da0e3af21199a1aa7d938801425022b1b9f0ec1ce4b171375cfa636,https://s.yimg.com/rz/stage/p/yahoo_finance_en-US_h_p_finance_2.png,Yahoo,https://finance.yahoo.com/news/broadcom-avgo-hits-key-milestone-134330041.html,https://finance.yahoo.com/news/broadcom-avgo-hits-key-milestone-134330041.html,https://finance.yahoo.com/news/broadcom-avgo-hits-key-milestone-134330041.html,yahoo.com,200,
finnhub,META,2025-10-13T13:28:00,3 Top Tech Stocks to Buy in October,These tech giants' momentum should continue into earnings season and well beyond.,https://finnhub.io/api/news?id=25c511a04de0be4ab3aefac75c1bef54c063fd4699ad404cadbd9e5fd04eca7a,https://s.yimg.com/rz/stage/p/yahoo_finance_en-US_h_p_finance_2.png,Yahoo,https://www.fool.com/investing/2025/10/13/3-top-tech-stocks-to-buy-in-october/,https://www.fool.com/investing/2025/10/13/3-top-tech-stocks-to-buy-in-october/,https://www.fool.com/investing/2025/10/13/3-top-tech-stocks-to-buy-in-october/,fool.com,200,
finnhub,META,2025-10-13T13:14:12,OpenAI taps Broadcom to build its first AI processor in latest chip deal,"Shares of Broadcom rose more than 12% in premarket trading.  The companies said on Monday that OpenAI would design the chips, which Broadcom will develop and deploy starting in the second half of 2026.  The agreement is the latest in a string of massive AI chip investments that have highlighted the technology industry's surging appetite for computing power as it races to build systems that meet or surpass human intelligence.",https://finnhub.io/api/news?id=cfe016686e8dc8184770a1e368fd8b3a84bb145fd7066ab367b0a03a8f07358d,https://s.yimg.com/rz/stage/p/yahoo_finance_en-US_h_p_finance_2.png,Yahoo,https://finance.yahoo.com/news/openai-taps-broadcom-build-first-131412725.html,https://finance.yahoo.com/news/openai-taps-broadcom-build-first-131412725.html,https://finance.yahoo.com/news/openai-taps-broadcom-build-first-131412725.html,yahoo.com,200,
finnhub,META,2025-10-13T12:07:28,Fee-Fi-Fo-Fum: Is A Giant Crash Brewing For AI Stocks?,"Amid hype over artificial intelligence, the best AI stocks generate revenue or get a strategic edge from the fast evolving technology.",https://finnhub.io/api/news?id=74506bbbaec73cf9b944e2b763325217ea4cdae2d3eb1fc3b2512039f21a132a,https://s.yimg.com/rz/stage/p/yahoo_finance_en-US_h_p_finance_2.png,Yahoo,https://finance.yahoo.com/m/684c930d-1475-3adc-b013-ae604c056ebc/fee-fi-fo-fum%3A-is-a-giant.html,https://finance.yahoo.com/m/684c930d-1475-3adc-b013-ae604c056ebc/fee-fi-fo-fum-is-a-giant.html,https://finance.yahoo.com/m/684c930d-1475-3adc-b013-ae604c056ebc/fee-fi-fo-fum-is-a-giant.html,yahoo.com,200,
finnhub,META,2025-10-13T12:00:00,"CSP CapEx to Soar Past US$520 Billion in 2026, Driven by GPU Procurement and ASIC Development, Says TrendForce","TAIPEI, Taiwan, Oct. 13, 2025 (GLOBE NEWSWIRE) -- TrendForce’s latest investigations reveal that the rapid expansion of AI server demand is propelling global cloud service providers (CSPs), such as Google, AWS, Meta, Microsoft, Oracle, Tencent, Alibaba, and Baidu, to boost investments in NVIDIA’s rack-scale GPU solutions, data center expansion, and in-house AI ASIC design. Total CapEx from the eight major CSPs is expected to surpass US$420 billion in 2025, roughly equivalent to their combined sp",https://finnhub.io/api/news?id=d688866990806c22fa47abaaf210141f7c234121d30744051d9a5bd762f82f33,https://s.yimg.com/rz/stage/p/yahoo_finance_en-US_h_p_finance_2.png,Yahoo,https://finance.yahoo.com/news/csp-capex-soar-past-us-120000610.html,https://finance.yahoo.com/news/csp-capex-soar-past-us-120000610.html,https://finance.yahoo.com/news/csp-capex-soar-past-us-120000610.html,yahoo.com,200,
finnhub,META,2025-10-13T11:44:57,"Meta Platforms: Healthy Fundamentals, Rare Technical Setup","Discover why Meta Platforms (META) may be a strong buy nowâsolid revenue growth, undervalued stock, and promising innovations. Click here to read more.",https://finnhub.io/api/news?id=09d5a55657197259cf23a83a135b77df305497ee72bba346d6f45ead3d0fd777,https://static.seekingalpha.com/cdn/s3/uploads/getty_images/2188450078/image_2188450078.jpg?io=getty-c-w1536,SeekingAlpha,https://seekingalpha.com/article/4829532-meta-platforms-healthy-fundamentals-rare-technical-setup,,https://seekingalpha.com/article/4829532-meta-platforms-healthy-fundamentals-rare-technical-setup,seekingalpha.com,403,
finnhub,META,2025-10-13T11:38:00,Tech Earnings Are Key to Stock Market Navigating Trump’s ‘October Surprise’,"President Donald Trump’s surprise escalation of trade war rhetoric with China last week and the threat of an additional 100% tariff on goods imported from the world’s second-largest economy hammered stocks on Friday.  “Don’t worry about China, it will all be fine,” the president declared in a social media message on Sunday, suggesting that the U.S. could reach an agreement on myriad outstanding issues with its biggest trading partner.  Last spring, when markets wobbled amid the renewed trade uncertainty, stocks regained their footing through a series of better-than-expected March quarter earnings reports from the megacap tech names.",https://finnhub.io/api/news?id=60234250ac6064e51dc65f62d5ed80e6141cc0926448ccf66818a9345e7ffbee,https://s.yimg.com/rz/stage/p/yahoo_finance_en-US_h_p_finance_2.png,Yahoo,https://finance.yahoo.com/m/d42f8739-d731-3db1-8bdd-c70ec7bd0782/tech-earnings-are-key-to.html,https://finance.yahoo.com/m/d42f8739-d731-3db1-8bdd-c70ec7bd0782/tech-earnings-are-key-to.html,https://finance.yahoo.com/m/d42f8739-d731-3db1-8bdd-c70ec7bd0782/tech-earnings-are-key-to.html,yahoo.com,200,
finnhub,META,2025-10-13T09:25:00,5 Reasons to Buy Global X Uranium ETF Like There's No Tomorrow,Nuclear energy is making a return in a big way. Here's how you can profit from it.,https://finnhub.io/api/news?id=d1481812b45e762f8dfb5dd54afad5c56877b9fe277698b13dca7ca843874abb,https://s.yimg.com/rz/stage/p/yahoo_finance_en-US_h_p_finance_2.png,Yahoo,https://www.fool.com/investing/2025/10/13/5-reasons-to-buy-global-x-uranium-etf-stock-like-t/,https://www.fool.com/investing/2025/10/13/5-reasons-to-buy-global-x-uranium-etf-stock-like-t/,https://www.fool.com/investing/2025/10/13/5-reasons-to-buy-global-x-uranium-etf-stock-like-t/,fool.com,200,
finnhub,META,2025-10-13T08:44:00,Stock Splits Ahead? 3 Artificial Intelligence (AI) Stocks to Keep on Your Radar,None of these AI leaders has announced forthcoming stock splits -- at least not yet.,https://finnhub.io/api/news?id=f6750e3fe673a0ac8c4f10ff3f0a234e177a4d9e51856865eafe3b6a5584edf1,https://s.yimg.com/rz/stage/p/yahoo_finance_en-US_h_p_finance_2.png,Yahoo,https://www.fool.com/investing/2025/10/13/stock-splits-ahead-3-artificial-intelligence-ai-st/,https://www.fool.com/investing/2025/10/13/stock-splits-ahead-3-artificial-intelligence-ai-st/,https://www.fool.com/investing/2025/10/13/stock-splits-ahead-3-artificial-intelligence-ai-st/,fool.com,200,
finnhub,META,2025-10-13T07:11:00,Meet the Supercharged Growth Stock That One Wall Street Analyst Thinks Is Poised to Hit $20 Trillion by 2030,"Despite the stock's rapid rise, one Wall Street analyst sees significant upside ahead for Nvidia investors.",https://finnhub.io/api/news?id=07b9dd81c680e4217c0100151397b5512fb0f8e6858e08f8758e5697464c3e16,https://s.yimg.com/rz/stage/p/yahoo_finance_en-US_h_p_finance_2.png,Yahoo,https://www.fool.com/investing/2025/10/13/meet-the-supercharged-growth-stock-one-wall-street/,https://www.fool.com/investing/2025/10/13/meet-the-supercharged-growth-stock-one-wall-street/,https://www.fool.com/investing/2025/10/13/meet-the-supercharged-growth-stock-one-wall-street/,fool.com,200,
finnhub,META,2025-10-13T05:00:00,Central banks stoked the dotcom bubble. They’re doing it again for AI,"Blow-out quarterly earnings estimates from American software and cloud services specialist Oracle, a $100bn (£75bn) investment in ChatGPT developer OpenAI by silicon chip designer Nvidia and, in reverse, the purchase of a 10pc stake by OpenAI in another semiconductor maker, AMD, are all keeping the artificial intelligence (AI) pot boiling, so far as stock markets are concerned.",https://finnhub.io/api/news?id=1bacb6b345011b87b62f365822cac95f91222dd3ac9e7ca6c9fa8b6e1728c8d9,https://s.yimg.com/rz/stage/p/yahoo_finance_en-US_h_p_finance_2.png,Yahoo,https://uk.finance.yahoo.com/news/central-banks-stoked-dotcom-bubble-050000056.html,https://uk.finance.yahoo.com/news/central-banks-stoked-dotcom-bubble-050000056.html,https://uk.finance.yahoo.com/news/central-banks-stoked-dotcom-bubble-050000056.html,yahoo.com,200,
finnhub,META,2025-10-13T04:06:41,Meta (META) in Focus as TD Cowen Sees Strong Quarter and Robust Ad Momentum,"Meta Platforms, Inc. (NASDAQ:META) is one of the AI Stocks on the Market’s Radar. On October 10, TD Cowen reiterated its Buy rating on the stock with a price target of $875.00. The rating affirmation comes ahead of the company’s third-quarter 2025 earnings report, due October 29. Analyst John Blackledge anticipates Meta to enjoy another successful […]",https://finnhub.io/api/news?id=0f2cfc1df4ecb76a6f89bc54eb8d35c97859335e6c177b6fcb0cfae0132357f1,https://s.yimg.com/rz/stage/p/yahoo_finance_en-US_h_p_finance_2.png,Yahoo,https://finance.yahoo.com/news/meta-meta-focus-td-cowen-040641672.html,https://finance.yahoo.com/news/meta-meta-focus-td-cowen-040641672.html,https://finance.yahoo.com/news/meta-meta-focus-td-cowen-040641672.html,yahoo.com,200,
finnhub,META,2025-10-13T01:10:00,"2 Stocks That May Crush the ""Magnificent Seven""","These stocks already are climbing, but they have plenty of room to run.",https://finnhub.io/api/news?id=b44b1ecdd2d09d3c25ab8c507f8f977930bc0184e9bc340e6cf0e32c4e6712f9,https://s.yimg.com/rz/stage/p/yahoo_finance_en-US_h_p_finance_2.png,Yahoo,https://www.fool.com/investing/2025/10/12/2-stocks-that-may-crush-the-magnificent-seven/,https://www.fool.com/investing/2025/10/12/2-stocks-that-may-crush-the-magnificent-seven/,https://www.fool.com/investing/2025/10/12/2-stocks-that-may-crush-the-magnificent-seven/,fool.com,200,
finnhub,META,2025-10-12T22:19:00,Prediction: These Will Be Wall Street's 2 Most Prominent Stock-Split Stocks of 2026,"Up over 400% in just three years, these industry leaders are ripe for stock splits in 2026.",https://finnhub.io/api/news?id=a308803e43f22ae070e38eb49218e9b170015e52f2703132aa8bfdcf8aff7334,https://s.yimg.com/rz/stage/p/yahoo_finance_en-US_h_p_finance_2.png,Yahoo,https://www.fool.com/investing/2025/10/12/wall-street-stock-split-buy-netflix-meta-2026/,https://www.fool.com/investing/2025/10/12/wall-street-stock-split-buy-netflix-meta-2026/,https://www.fool.com/investing/2025/10/12/wall-street-stock-split-buy-netflix-meta-2026/,fool.com,200,
finnhub,META,2025-10-12T19:52:07,"SP500: It's A Dip, Not A Bubble Burst (Yet)",S&P 500 reacts to US-China trade war but AI stocks remain strong. Learn why increased volatility signals caution for investors.,https://finnhub.io/api/news?id=2b375f6253e073584b9dfc4ee82ba09934c1d7f91a63c0c54be01e17a03145f5,https://static.seekingalpha.com/cdn/s3/uploads/getty_images/2226497011/image_2226497011.jpg?io=getty-c-w1536,SeekingAlpha,https://seekingalpha.com/article/4829395-sp500-it-is-a-dip-not-a-bubble-burst-yet,,https://seekingalpha.com/article/4829395-sp500-it-is-a-dip-not-a-bubble-burst-yet,seekingalpha.com,403,
finnhub,META,2025-10-12T17:03:04,Fee-Fi-Fo-Fum: Is A Crash Brewing For AI Stocks?,"Amid hype over artificial intelligence, the best AI stocks generate revenue or get a strategic edge from the fast evolving technology.",https://finnhub.io/api/news?id=93a0432b7cd73581a5e3a5c2be70106be2e497ee7caf0d69ae074c560f983c87,https://s.yimg.com/rz/stage/p/yahoo_finance_en-US_h_p_finance_2.png,Yahoo,https://finance.yahoo.com/m/684c930d-1475-3adc-b013-ae604c056ebc/fee-fi-fo-fum%3A-is-a-crash.html,https://finance.yahoo.com/m/684c930d-1475-3adc-b013-ae604c056ebc/fee-fi-fo-fum-is-a-giant.html,https://finance.yahoo.com/m/684c930d-1475-3adc-b013-ae604c056ebc/fee-fi-fo-fum-is-a-giant.html,yahoo.com,200,
finnhub,META,2025-10-12T13:00:00,Our Faces No Longer Belong to Us,Your likeness is now fair game for AI. Anyone is a click away from creating a digital version of you.,https://finnhub.io/api/news?id=712fc590b71383221015373ad19b8599595514ee96ea49532534f4849346c9e8,https://s.yimg.com/rz/stage/p/yahoo_finance_en-US_h_p_finance_2.png,Yahoo,https://finance.yahoo.com/m/79be19f9-460f-30f0-8ba3-33ba2ba90501/our-faces-no-longer-belong-to.html,https://finance.yahoo.com/m/79be19f9-460f-30f0-8ba3-33ba2ba90501/our-faces-no-longer-belong-to.html,https://finance.yahoo.com/m/79be19f9-460f-30f0-8ba3-33ba2ba90501/our-faces-no-longer-belong-to.html,yahoo.com,200,
finnhub,META,2025-10-12T12:16:00,"1 Unstoppable Stock That Could Join Nvidia, Apple, Microsoft, Amazon, Alphabet, Meta, and Tesla in the $1 Trillion Club","The boom in artificial intelligence (AI) has led to strong growth for Oracle's business, and more could be on the way.",https://finnhub.io/api/news?id=5aadf94b82e439ed478948fb7d97d96decdde4f675c285107a8f6f14c70f72c2,https://s.yimg.com/rz/stage/p/yahoo_finance_en-US_h_p_finance_2.png,Yahoo,https://www.fool.com/investing/2025/10/12/1-unstoppable-stock-that-could-join-nvidia-apple-m/,https://www.fool.com/investing/2025/10/12/1-unstoppable-stock-that-could-join-nvidia-apple-m/,https://www.fool.com/investing/2025/10/12/1-unstoppable-stock-that-could-join-nvidia-apple-m/,fool.com,200,
finnhub,META,2025-10-12T08:35:53,QGRW: Leading Growth ETF With A Caveat,"Discover QGRW ETF: blending growth & quality in large-cap stocks, outperforming peers but with higher volatility.",https://finnhub.io/api/news?id=f6c6053438f4fd25de8b169e55a88b33958008e521c03c2e5745794154249c57,https://static.seekingalpha.com/cdn/s3/uploads/getty_images/1394881057/image_1394881057.jpg?io=getty-c-w1536,SeekingAlpha,https://seekingalpha.com/article/4829375-qgrw-leading-growth-etf-with-caveat,,https://seekingalpha.com/article/4829375-qgrw-leading-growth-etf-with-caveat,seekingalpha.com,403,
finnhub,META,2025-10-12T08:35:00,"Meet the Potential Stock-Split Stock That Soared by 470% Over the Past 15 Years. Now, It's Poised to Join Nvidia, Apple, Microsoft, Amazon, Alphabet, Meta, and Tesla in the $1 Trillion Club by 2026.",This historically low-tech business is getting a digital upgrade.,https://finnhub.io/api/news?id=76357a8e5e89635b420ba7446e2eb158958b1ef3d1c7479f6a5d54dec2680474,https://s.yimg.com/rz/stage/p/yahoo_finance_en-US_h_p_finance_2.png,Yahoo,https://www.fool.com/investing/2025/10/12/meet-the-stock-split-stock-that-soared-by-470-over/,https://www.fool.com/investing/2025/10/12/meet-the-stock-split-stock-that-soared-by-470-over/,https://www.fool.com/investing/2025/10/12/meet-the-stock-split-stock-that-soared-by-470-over/,fool.com,200,
finnhub,META,2025-10-12T08:30:00,"If I Could Only Buy and Hold a Single Stock, This Would Be It",This contrarian pick has richly rewarded shareholders over the years.,https://finnhub.io/api/news?id=61350c439938393624ad8e282abc531e151a2d86c53f316f995da8e71381961d,https://s.yimg.com/rz/stage/p/yahoo_finance_en-US_h_p_finance_2.png,Yahoo,https://www.fool.com/investing/2025/10/12/if-i-could-only-buy-and-hold-a-single-stock-this-w/,https://www.fool.com/investing/2025/10/12/if-i-could-only-buy-and-hold-a-single-stock-this-w/,https://www.fool.com/investing/2025/10/12/if-i-could-only-buy-and-hold-a-single-stock-this-w/,fool.com,200,
