provider,ticker,published_utc,headline,summary,url_redirect,image_url,source,url_final,url_canonical,url_original,domain,http_status,error
finnhub,META,2025-09-25T04:04:42,Louisiana's $3B power upgrade for Meta project raises questions about who should foot the bill,"In a rural corner of Louisiana, Meta is building one of the world's largest data centers, a $10 billion behemoth as big as 70 football fields that will consume more power in a day than the entire city of New Orleans at the peak of summer.  While the colossal project is impossible to miss in Richland Parish, a farming community of 20,000 residents, not everything is visible, including how much the social media giant will pay toward the more than $3 billion in new electricity infrastructure needed to power the facility.  Watchdogs have warned that in the rush to capitalize on the AI-driven data center boom, some states are allowing massive tech companies to direct expensive infrastructure projects with limited oversight.",https://finnhub.io/api/news?id=0dcf8e7e9a76149d245db7d7e30fecc7d70de02e663edd8fb44dcb07d7e28f05,https://s.yimg.com/rz/stage/p/yahoo_finance_en-US_h_p_finance_2.png,Yahoo,https://finance.yahoo.com/news/louisianas-3b-power-upgrade-meta-040442882.html,https://finance.yahoo.com/news/louisianas-3b-power-upgrade-meta-040442882.html,https://finance.yahoo.com/news/louisianas-3b-power-upgrade-meta-040442882.html,yahoo.com,200,
finnhub,META,2025-09-25T01:02:00,Jefferies Initiates Coverage on Entergy Corporation (ETR) with a ‘Buy’ Rating and a $109 Price Target,"Entergy Corporation (NYSE:ETR) is one of the 11 Best Nuclear Energy Stocks to Invest in Right Now. On September 4, 2025, Jefferies began covering Entergy Corporation (NYSE:ETR) with a ‘Buy’ rating and a $109 price target, calling it the “best-positioned AI load play” in utilities. Jefferies highlighted Entergy’s 8 GW of power generation already contracted […]",https://finnhub.io/api/news?id=ed3dad905c70c1508f0b5fdc878d54926753f0168dbdb579d32cf6d185fe7078,https://s.yimg.com/rz/stage/p/yahoo_finance_en-US_h_p_finance_2.png,Yahoo,https://finance.yahoo.com/news/jefferies-initiates-coverage-entergy-corporation-010200274.html,https://finance.yahoo.com/news/jefferies-initiates-coverage-entergy-corporation-010200274.html,https://finance.yahoo.com/news/jefferies-initiates-coverage-entergy-corporation-010200274.html,yahoo.com,200,
finnhub,META,2025-09-25T00:13:42,Oracle slips on reports of unexpected debt plan,Oracle stock slips as it raises $15 billion cash by selling debt,https://finnhub.io/api/news?id=382b406ad8b37961cf0ec688f2ed2ff0090ee903e23194b73695d12a1687ec31,https://s.yimg.com/rz/stage/p/yahoo_finance_en-US_h_p_finance_2.png,Yahoo,https://www.thestreet.com/investing/oracles-15-billion-bond-sale-underlines-ai-expansion-costs-,,https://www.thestreet.com/investing/oracles-15-billion-bond-sale-underlines-ai-expansion-costs-,thestreet.com,403,
finnhub,META,2025-09-24T20:53:00,AI Arms Race Intensifies Again. Here Are the 2 Big Takeaways For Investors.,"A slowdown in the race to invest in and build AI infrastructure isn’t in sight yet, which bodes well for the AI trade.",https://finnhub.io/api/news?id=0a3e364329b1b305deb1d03b372d4a87a0ea8542bec87f11f87d3f6d680d181f,https://s.yimg.com/rz/stage/p/yahoo_finance_en-US_h_p_finance_2.png,Yahoo,https://finance.yahoo.com/m/838f04a2-7275-336a-b9dc-62851aa1e140/ai-arms-race-intensifies.html,https://finance.yahoo.com/m/838f04a2-7275-336a-b9dc-62851aa1e140/ai-arms-race-intensifies.html,https://finance.yahoo.com/m/838f04a2-7275-336a-b9dc-62851aa1e140/ai-arms-race-intensifies.html,yahoo.com,200,
finnhub,META,2025-09-24T18:06:36,"Instagram hits 3B users, Intel rises, Keurig Dr Pepper downgrade","Yahoo Finance anchor Josh Lipton tracks Wednesday's top moving stocks and biggest market stories in this Market Minute. Meta (META) CEO Mark Zuckerberg announced that Instagram has reached 3 billion monthly active users. Intel (INTC) stock is surging, inching closer to a 52-week high. Keurig Dr Pepper (KDP) was downgraded to Equal Weight from Overweight by Barclays. Stay up to date on the latest market action, minute-by-minute, with Yahoo Finance's Market Minute.",https://finnhub.io/api/news?id=88d23a04fd05484dcaa0f7e27d80e34cfd4a8be2be7e95e306e067bd3dab0044,https://s.yimg.com/rz/stage/p/yahoo_finance_en-US_h_p_finance_2.png,Yahoo,https://finance.yahoo.com/video/instagram-hits-3b-users-intel-180636234.html,https://finance.yahoo.com/video/instagram-hits-3b-users-intel-180636234.html,https://finance.yahoo.com/video/instagram-hits-3b-users-intel-180636234.html,yahoo.com,200,
finnhub,META,2025-09-24T17:41:36,Meta Says Instagram Hits 3 Billion Monthly Users,Milestone puts the app alongside Facebook and WhatsApp,https://finnhub.io/api/news?id=78d9eff61dbee2e273007876dd1e93681032ff9c629496334a41326eec7ad1a2,https://s.yimg.com/rz/stage/p/yahoo_finance_en-US_h_p_finance_2.png,Yahoo,https://finance.yahoo.com/news/meta-says-instagram-hits-3-174136043.html,https://finance.yahoo.com/news/meta-says-instagram-hits-3-174136043.html,https://finance.yahoo.com/news/meta-says-instagram-hits-3-174136043.html,yahoo.com,200,
finnhub,META,2025-09-24T17:00:00,"Tech Forum 2025: ASICs, packaging, and HBM reshape the AI chip race","The global market for high-end cloud AI accelerators is approaching a major turning point. DIGITIMES forecasts that beginning in 2026, the supply chain will enter a new ""decentralized"" phase shaped by three forces: the expansion of custom ASICs, diversification of advanced packaging, and intensifying competition in high-bandwidth memory (HBM) pricing.",https://finnhub.io/api/news?id=556dc4d3049e4a5052856e42d44265e072d358183202f26f6926f7bf738d831b,https://s.yimg.com/rz/stage/p/yahoo_finance_en-US_h_p_finance_2.png,Yahoo,https://finance.yahoo.com/news/tech-forum-2025-asics-packaging-170000051.html,https://finance.yahoo.com/news/tech-forum-2025-asics-packaging-170000051.html,https://finance.yahoo.com/news/tech-forum-2025-asics-packaging-170000051.html,yahoo.com,200,
finnhub,META,2025-09-24T16:19:07,"Instagram now has 3 billion monthly active users, will test features to help users control their feeds","As Instagram celebrates the 3 billion milestone, it also plans to roll out features that help users control what content is algorithmically recommended to them.",https://finnhub.io/api/news?id=8f9931a24b8ef26593edffeeb2bbb228257e2adad5fb2a0d6ee005c854966c5d,https://s.yimg.com/rz/stage/p/yahoo_finance_en-US_h_p_finance_2.png,Yahoo,https://finance.yahoo.com/news/instagram-now-3-billion-monthly-161907355.html,https://finance.yahoo.com/news/instagram-now-3-billion-monthly-161907355.html,https://finance.yahoo.com/news/instagram-now-3-billion-monthly-161907355.html,yahoo.com,200,
finnhub,META,2025-09-24T16:09:17,Oracle is reportedly looking to raise $15B in corporate bond sale,This news comes just a few weeks after Oracle allegedly inked a $300 billion compute deal with OpenAI that surprised the market.,https://finnhub.io/api/news?id=11cfd8baa1f514bceccd07ab4f71efaf4a360f6dd35ae36c1c316ebd9512bbe0,https://s.yimg.com/rz/stage/p/yahoo_finance_en-US_h_p_finance_2.png,Yahoo,https://finance.yahoo.com/news/oracle-reportedly-looking-raise-15b-160917770.html,https://finance.yahoo.com/news/oracle-reportedly-looking-raise-15b-160917770.html,https://finance.yahoo.com/news/oracle-reportedly-looking-raise-15b-160917770.html,yahoo.com,200,
finnhub,META,2025-09-24T16:00:13,Market Chatter: Meta Platforms' Instagram Reaches 3 Billion Monthly Active Users,Meta Platforms' (META) Instagram unit has reached 3 billion monthly active users and is making adjus,https://finnhub.io/api/news?id=1a7ca937ea2e634db934cee259e7e6629d06e1591aa6c5bddeeeba71369a61d7,https://s.yimg.com/rz/stage/p/yahoo_finance_en-US_h_p_finance_2.png,Yahoo,https://finance.yahoo.com/news/market-chatter-meta-platforms-apos-160013807.html,https://finance.yahoo.com/news/market-chatter-meta-platforms-apos-160013807.html,https://finance.yahoo.com/news/market-chatter-meta-platforms-apos-160013807.html,yahoo.com,200,
finnhub,META,2025-09-24T15:56:46,Meta CEO Zuckerberg says Instagram has grown to 3 billion monthly active users,"Meta last disclosed Instagram's user figures in 2022 when Zuckerberg said the app had hit more than 2 billion monthly active users.  Meta, previously known as Facebook, bought Instagram for $1 billion in 2012, a move that had raised questions about the company's strategy as the social media app had begun with just photo-sharing without significant revenue.  Since then the app has grown astronomically and some firms have estimated it will make up more than half of Meta's U.S. ad revenue this year.",https://finnhub.io/api/news?id=a38e201ecdb6a55376168c5beed8359f9392d31a1f78ca3be6bbd2c0030d350c,https://s.yimg.com/rz/stage/p/yahoo_finance_en-US_h_p_finance_2.png,Yahoo,https://finance.yahoo.com/news/meta-ceo-zuckerberg-says-instagram-155646162.html,https://finance.yahoo.com/news/meta-ceo-zuckerberg-says-instagram-155646162.html,https://finance.yahoo.com/news/meta-ceo-zuckerberg-says-instagram-155646162.html,yahoo.com,200,
finnhub,META,2025-09-24T15:39:19,Meta launches lobbying effort to target state AI laws,The company created a super PAC to back candidates who align with the company on AI oversight. It’s the latest sign of industry displeasure toward state AI laws.,https://finnhub.io/api/news?id=b709372d3def3bafeda72024e213345202b271f49e743adb88850362cb8886f2,https://s.yimg.com/rz/stage/p/yahoo_finance_en-US_h_p_finance_2.png,Yahoo,https://www.ciodive.com/news/meta-lobbying-state-ai-laws/761047/,https://www.ciodive.com/news/meta-lobbying-state-ai-laws/761047/,https://www.ciodive.com/news/meta-lobbying-state-ai-laws/761047/,ciodive.com,200,
finnhub,META,2025-09-24T15:08:00,Meta Dips As New AI-Focused Super PAC Raises Stakes In Policy Fight,,https://finnhub.io/api/news?id=042528d11aa26937f6a5280d75699aae21cf9d931279373b2767b5e66a3b7362,,SeekingAlpha,https://seekingalpha.com/article/4825597-meta-dips-as-new-ai-focused-super-pac-raises-stakes-in-policy-fight,,https://seekingalpha.com/article/4825597-meta-dips-as-new-ai-focused-super-pac-raises-stakes-in-policy-fight,seekingalpha.com,403,
finnhub,META,2025-09-24T15:00:52,Q3 ad spending is trending ahead of initial expectations: expert,"Investing.com -- Third-quarter online ad spending is running stronger than anticipated, with artificial intelligence emerging as a key driver, according to Bank of America.",https://finnhub.io/api/news?id=9f5aeb1b102baa95053e4793ac79ca2b9b84089d62909b5cffe002265241594f,https://s.yimg.com/rz/stage/p/yahoo_finance_en-US_h_p_finance_2.png,Yahoo,https://finance.yahoo.com/news/q3-ad-spending-trending-ahead-150052463.html,https://finance.yahoo.com/news/q3-ad-spending-trending-ahead-150052463.html,https://finance.yahoo.com/news/q3-ad-spending-trending-ahead-150052463.html,yahoo.com,200,
finnhub,META,2025-09-24T14:00:00,3 days left: Don’t miss your last chance to lock $668 of savings for TechCrunch Disrupt 2025,"There’s no event quite like TechCrunch Disrupt, and if you’ve never been, this is the year to change that. You have just 3 days left to save up to $668 on your pass.",https://finnhub.io/api/news?id=8c8a166c607b4e8fba877ecf833613fefef14845d445d505f28dbd4e1862ac66,https://s.yimg.com/rz/stage/p/yahoo_finance_en-US_h_p_finance_2.png,Yahoo,https://finance.yahoo.com/news/3-days-left-don-t-140000107.html,https://finance.yahoo.com/news/3-days-left-don-t-140000107.html,https://finance.yahoo.com/news/3-days-left-don-t-140000107.html,yahoo.com,200,
finnhub,META,2025-09-24T13:54:27,"Meta (META) Unveils AI Glasses at Connect Conference, Stifel Maintains Buy Rating","Meta Platforms, Inc. (NASDAQ:META) ranks among the best hot AI stocks to buy right now. Following Meta’s keynote presentation at the Annual Connect conference on September 17, Stifel reiterated its $900 price target for Meta Platforms, Inc. (NASDAQ:META) and maintained its Buy rating on the company’s shares. The conference featured Meta’s newest range of AI […]",https://finnhub.io/api/news?id=ba2edfce780e4aaee4abea30ea4c03a723375aa4a60d518a79046cd6926d8248,https://s.yimg.com/rz/stage/p/yahoo_finance_en-US_h_p_finance_2.png,Yahoo,https://finance.yahoo.com/news/meta-meta-unveils-ai-glasses-135427316.html,https://finance.yahoo.com/news/meta-meta-unveils-ai-glasses-135427316.html,https://finance.yahoo.com/news/meta-meta-unveils-ai-glasses-135427316.html,yahoo.com,200,
finnhub,META,2025-09-24T13:49:39,1 AI Stock to Buy and 1 to Avoid in 2025,"While some stocks are poised for growth, others may disappoint investors.",https://finnhub.io/api/news?id=2c9869734da0ee6227910f56636150bc70ea7ab8e24ee2bd92578e1ee64a36b0,https://s.yimg.com/rz/stage/p/yahoo_finance_en-US_h_p_finance_2.png,Yahoo,https://www.barchart.com/story/news/35007578/1-ai-stock-to-buy-and-1-to-avoid-in-2025,https://www.barchart.com/story/news/35007578/1-ai-stock-to-buy-and-1-to-avoid-in-2025,https://www.barchart.com/story/news/35007578/1-ai-stock-to-buy-and-1-to-avoid-in-2025,barchart.com,200,
finnhub,META,2025-09-24T13:19:41,Oracle Looks to Raise $15 Billion From Corporate Bond Sale,"The technology giant — which has nearly doubled in value this year — is selling the debt in as many as seven parts, including a rare 40-year bond, people familiar with the matter said, asking not to be identified discussing private details.  Initial price discussions for that portion of the deal are in the area of 1.65 percentage point above similarly dated Treasuries.  The deal comes as Oracle begins to fulfill massive cloud infrastructure deals with customers like OpenAI and Meta Platforms Inc., which are boosting the company’s expenses.",https://finnhub.io/api/news?id=878260d2a3775260922d1433afe7b002efc3a2214149bb0c15b0b04ca8258657,https://s.yimg.com/rz/stage/p/yahoo_finance_en-US_h_p_finance_2.png,Yahoo,https://finance.yahoo.com/news/oracle-looks-raise-15-billion-131941293.html,https://finance.yahoo.com/news/oracle-looks-raise-15-billion-131941293.html,https://finance.yahoo.com/news/oracle-looks-raise-15-billion-131941293.html,yahoo.com,200,
finnhub,META,2025-09-24T13:14:28,"Coinbase, Sony and Samsung Back $14.6M Round for Stablecoin Startup Bastion","The firm white-label stablecoin systems, enabling companies to issue digital dollars without coding or their own regulatory licenses.",https://finnhub.io/api/news?id=9783cf98ecf0b40d330a23935462304a192f5ca79baa77f4e76a6e0df5d210fb,https://s.yimg.com/rz/stage/p/yahoo_finance_en-US_h_p_finance_2.png,Yahoo,https://www.coindesk.com/business/2025/09/24/coinbase-sony-and-samsung-back-usd14-6m-round-for-stablecoin-startup-bastion,https://www.coindesk.com/business/2025/09/24/coinbase-sony-and-samsung-back-usd14-6m-round-for-stablecoin-startup-bastion,https://www.coindesk.com/business/2025/09/24/coinbase-sony-and-samsung-back-usd14-6m-round-for-stablecoin-startup-bastion,coindesk.com,200,
finnhub,META,2025-09-24T13:08:11,Meta Expands Llama AI Access To Global Allies For National Security,"Meta Platforms (NASDAQ:META) is broadening access to its Llama AI models for key U.S. allies, aiming to enhance national security, operational efficiency, and mission-specific capabilities. The move ensures the United States and its closest partners have advanced tools to protect citizens and maintain technological leadership. Since last year, Llama has been available to U.S. government agencies and private sector partners supporting defense applications. Also Read: Meta Teams Up With US Governm",https://finnhub.io/api/news?id=241f0e6a09b2337e47b8d02691a627fd6cf9a239359da2b8f89b899dc8b82193,https://s.yimg.com/rz/stage/p/yahoo_finance_en-US_h_p_finance_2.png,Yahoo,https://finance.yahoo.com/news/meta-expands-llama-ai-access-130811336.html,https://finance.yahoo.com/news/meta-expands-llama-ai-access-130811336.html,https://finance.yahoo.com/news/meta-expands-llama-ai-access-130811336.html,yahoo.com,200,
finnhub,META,2025-09-24T13:00:35,Dan Niles Says Alphabet (GOOG) Will Have the ‘Best App’ for AI – ‘They’re in Great Shape’,"We recently published These 10 Stocks are Buzzing After Important Analyst Calls. Alphabet Inc. (NASDAQ:GOOG) is one of the stocks analysts were recently talking about. Dan Niles, Niles Investment Management founder and portfolio manager, said in a latest program on CNBC that he believes Alphabet will have the “best app” in terms of AI. Niles […]",https://finnhub.io/api/news?id=c91166bc3f75a01e375ce60ae7622998b56dd2cb47769efd588c8f3dfd80846f,https://s.yimg.com/rz/stage/p/yahoo_finance_en-US_h_p_finance_2.png,Yahoo,https://finance.yahoo.com/news/dan-niles-says-alphabet-goog-130035400.html,https://finance.yahoo.com/news/dan-niles-says-alphabet-goog-130035400.html,https://finance.yahoo.com/news/dan-niles-says-alphabet-goog-130035400.html,yahoo.com,200,
finnhub,META,2025-09-24T13:00:00,Abbott Hosts Conference Call for Third-Quarter Earnings,"Abbott (NYSE: ABT) will announce its third-quarter 2025 financial results on Wednesday, Oct. 15, before the market opens.",https://finnhub.io/api/news?id=a163fd6b389b4b6299b072e5ce48d0affe8607786fcc5633410db761f174d0fb,https://s.yimg.com/rz/stage/p/yahoo_finance_en-US_h_p_finance_2.png,Yahoo,https://finance.yahoo.com/news/abbott-hosts-conference-call-third-130000748.html,https://finance.yahoo.com/news/abbott-hosts-conference-call-third-130000748.html,https://finance.yahoo.com/news/abbott-hosts-conference-call-third-130000748.html,yahoo.com,200,
finnhub,META,2025-09-24T12:45:48,Meta (META) Stock Target Reaffirmed Despite Regulatory Challenges in U.S. and Europe,"Meta Platforms, Inc. (NASDAQ:META) ranks among the hot stocks to invest in right now. On September 8, Cantor Fitzgerald reaffirmed its $920 price target and Overweight rating for Meta Platforms, Inc. (NASDAQ:META), as the company contends with numerous regulatory obstacles. The social media behemoth is currently facing a lawsuit from the Federal Trade Commission for […]",https://finnhub.io/api/news?id=2ef1660e4d55fda9ceb3d20e0933c9ec9ae2431fe39325acc95fc0cbf6431509,https://s.yimg.com/rz/stage/p/yahoo_finance_en-US_h_p_finance_2.png,Yahoo,https://finance.yahoo.com/news/meta-meta-stock-target-reaffirmed-124548869.html,https://finance.yahoo.com/news/meta-meta-stock-target-reaffirmed-124548869.html,https://finance.yahoo.com/news/meta-meta-stock-target-reaffirmed-124548869.html,yahoo.com,200,
finnhub,META,2025-09-24T11:36:12,5 Clear Signs Of Market Euphoria,How high can the current market really go? Discover five key signs of market euphoria driving surging valuations amid the AI revolution.,https://finnhub.io/api/news?id=33b97c76e69ee559d4c08e7a8c6366340ce6e0c41a48a671b0c630eaea5d0fbf,https://static.seekingalpha.com/cdn/s3/uploads/getty_images/1468441453/image_1468441453.jpg?io=getty-c-w1536,SeekingAlpha,https://seekingalpha.com/article/4825510-5-clear-signs-of-market-euphoria,,https://seekingalpha.com/article/4825510-5-clear-signs-of-market-euphoria,seekingalpha.com,403,
finnhub,META,2025-09-24T11:17:00,Circus SE Becomes European Partner in Meta’s Expansion of AI Models to Defense and Security,"MUNICH, September 24, 2025--Circus SE (XETRA: CA1), a global technology leader in AI robotics for autonomous nutrition systems and troop supply, today announces the extension of its collaborative partnership with Meta to its Llama for defense AI program.",https://finnhub.io/api/news?id=8e404b6d723adade04f80ab96c42785bea0b8bac7b0681c231ce90f3cd3404be,https://s.yimg.com/rz/stage/p/yahoo_finance_en-US_h_p_finance_2.png,Yahoo,https://finance.yahoo.com/news/circus-se-becomes-european-partner-111700800.html,https://finance.yahoo.com/news/circus-se-becomes-european-partner-111700800.html,https://finance.yahoo.com/news/circus-se-becomes-european-partner-111700800.html,yahoo.com,200,
finnhub,META,2025-09-24T11:15:50,"AI Weekly: Stargate shines, Meta's Llama rises","STORY: From AI giants planning new U.S. data centers, to a smart airport corridor, this is AI Weekly. :: AI Weekly OpenAI, Oracle and SoftBank have announced plans for five new AI data centers in the U.S.It's part of the $500 billion Stargate project to build AI infrastructure, a priority of President Trump.  The five centers, in locations including New Mexico and Texas, are expected to create 25,000 onsite jobs.And on OpenAI, Nvidia will invest up to $100 billion in the ChatGPT-owner.It's a tie up between two titans in the global artificial intelligence race. In return OpenAI will get the access it needs to buy cutting-edge chips - something which could cause concern for rivals of both firms. Meta's AI system Llama has been approved for U.S. government use.Agencies can experiment with the free language model, as the administration pushes to integrate AI. Meta said it's now expanding access to a number of U.S. democratic allies in Europe and Asia.A new AI-powered app says it is helping to keep young smartphone users safe online.The Sway.ly app said it alerts both children and their parents when they are exposed to harmful content. It also re-trains feeds in real-time and gives parents insights into their children's online activities.Dubai Airport has debuted a contactless lane that lets passengers clear immigration without documents.The smart tunnel system uses AI-powered biometric technology to verify travelers' identities automatically. Officials said Dubai plans to expand it to other terminals and airports in the near future.",https://finnhub.io/api/news?id=2a9a80bd171ef3f7d2d69101725a6e175803e8238ed4add08013eecdbd090c8b,https://s.yimg.com/rz/stage/p/yahoo_finance_en-US_h_p_finance_2.png,Yahoo,https://finance.yahoo.com/video/ai-weekly-stargate-shines-metas-111550506.html,https://finance.yahoo.com/video/ai-weekly-stargate-shines-metas-111550506.html,https://finance.yahoo.com/video/ai-weekly-stargate-shines-metas-111550506.html,yahoo.com,200,
finnhub,META,2025-09-24T08:00:40,Big Tech's AI ambitions are straining the US power grid. Natural gas might be its answer.,Natural gas looks set for a demand boom as AI developers turn to off-grid power to avoid long delays.,https://finnhub.io/api/news?id=48792148cb0a1d7d32407890383a0b39182a7b3ca9d17158089676076884c9a4,https://s.yimg.com/rz/stage/p/yahoo_finance_en-US_h_p_finance_2.png,Yahoo,https://finance.yahoo.com/news/big-techs-ai-ambitions-are-straining-the-us-power-grid-natural-gas-might-be-its-answer-080040857.html,https://finance.yahoo.com/news/big-techs-ai-ambitions-are-straining-the-us-power-grid-natural-gas-might-be-its-answer-080040857.html,https://finance.yahoo.com/news/big-techs-ai-ambitions-are-straining-the-us-power-grid-natural-gas-might-be-its-answer-080040857.html,yahoo.com,200,
finnhub,META,2025-09-24T07:30:00,Why The S&P 500 Could Be The Biggest Risk In Your Portfolio Right Now,"I see risks building in the S&P 500 as concentration and valuations rise, making future returns less certain. Read why smart diversification is key.",https://finnhub.io/api/news?id=8b41d0e5ceeb548007bcbcad1855b5a65afcc92fbd803e83a6b1a27b6709d401,https://static.seekingalpha.com/cdn/s3/uploads/getty_images/1084361828/image_1084361828.jpg?io=getty-c-w1536,SeekingAlpha,https://seekingalpha.com/article/4825178-why-sp500-could-be-biggest-risk-in-your-portfolio-right-now,,https://seekingalpha.com/article/4825178-why-sp500-could-be-biggest-risk-in-your-portfolio-right-now,seekingalpha.com,403,
finnhub,META,2025-09-24T05:58:08,"Datadog Appoints Former WhatsApp, Meta Product Leader Ami Vora to Board of Directors","Datadog Inc. (NASDAQ:DDOG) is one of the most promising long-term stocks to buy. On September 11, Datadog announced the appointment of Ami Vora to its Board of Directors. Vora is expected to provide invaluable guidance during Datadog’s next phase of growth due to her extensive experience in product leadership. Ami Vora brings over 20 years of […]",https://finnhub.io/api/news?id=43672373ac0014dbbd9ce76f1fb8441c0b66d03cecf8c845b315b89d2a6736b2,https://s.yimg.com/rz/stage/p/yahoo_finance_en-US_h_p_finance_2.png,Yahoo,https://finance.yahoo.com/news/datadog-appoints-former-whatsapp-meta-055808788.html,https://finance.yahoo.com/news/datadog-appoints-former-whatsapp-meta-055808788.html,https://finance.yahoo.com/news/datadog-appoints-former-whatsapp-meta-055808788.html,yahoo.com,200,
finnhub,META,2025-09-24T04:39:10,1 Cash-Heavy Stock on Our Watchlist and 2 We Find Risky,"A cash-heavy balance sheet is often a sign of strength, but not always. Some companies avoid debt because they have weak business models, limited expansion opportunities, or inconsistent cash flow.",https://finnhub.io/api/news?id=d011b9add048f57da1b8b1872be39567262167e8cce3d3227f12346fdfc6fa30,https://s.yimg.com/rz/stage/p/yahoo_finance_en-US_h_p_finance_2.png,Yahoo,https://finance.yahoo.com/news/1-cash-heavy-stock-watchlist-043910893.html,https://finance.yahoo.com/news/1-cash-heavy-stock-watchlist-043910893.html,https://finance.yahoo.com/news/1-cash-heavy-stock-watchlist-043910893.html,yahoo.com,200,
finnhub,META,2025-09-23T22:17:00,Nvidia's deal with OpenAI 'looks a lot like financial theatre',Nvidia's proposed deal raises a lot of questions.,https://finnhub.io/api/news?id=af03d66082cdb74005d098eb270e1c4189793c7cbd13c78380ad795ea3809ac9,https://s.yimg.com/rz/stage/p/yahoo_finance_en-US_h_p_finance_2.png,Yahoo,https://www.thestreet.com/technology/nvidia-100-billion-deal-with-openai-looks-like-financial-theatre,,https://www.thestreet.com/technology/nvidia-100-billion-deal-with-openai-looks-like-financial-theatre,thestreet.com,403,
