provider,ticker,published_utc,headline,summary,url_redirect,image_url,source,url_final,url_canonical,url_original,domain,http_status,error
finnhub,META,2025-10-02T14:54:23,OpenAI Is World's Top Startup With $500B Valuation After Employee Share Sale,"OpenAI has reportedly finalized a secondary share sale that values the artificial intelligence company at $500 billion, making the ChatGPT owner the world's most valuable startup.",https://finnhub.io/api/news?id=d5c1c7cdd5ade7de19b47e9cdd2eac8fbe7e77258c639939d83a97e099e0f679,https://s.yimg.com/rz/stage/p/yahoo_finance_en-US_h_p_finance_2.png,Yahoo,https://www.investopedia.com/openai-is-worlds-top-startup-with-500b-valuation-after-employee-share-sale-11822885,https://www.investopedia.com/openai-is-worlds-top-startup-with-500b-valuation-after-employee-share-sale-11822885,https://www.investopedia.com/openai-is-worlds-top-startup-with-500b-valuation-after-employee-share-sale-11822885,investopedia.com,200,
finnhub,META,2025-10-02T14:35:44,OpenAI is the world’s most valuable private company after private stock sale,"OpenAI employees sold $6.6B in shares, leading company's valuation to jump to $500B.",https://finnhub.io/api/news?id=68ed1e317779b5076619381c6b8e5588ce7225e2f3cfb4616233981e7dcc2de3,https://s.yimg.com/rz/stage/p/yahoo_finance_en-US_h_p_finance_2.png,Yahoo,https://finance.yahoo.com/news/openai-world-most-valuable-private-143544440.html,https://finance.yahoo.com/news/openai-world-most-valuable-private-143544440.html,https://finance.yahoo.com/news/openai-world-most-valuable-private-143544440.html,yahoo.com,200,
finnhub,META,2025-10-02T13:13:59,DigitalOcean Unveils AI Hub To Supercharge Developer Innovation,"DigitalOcean Holdings Inc. (NYSE:DOCN) rolled out new artificial intelligence initiatives at its Deploy London conference, introducing the DigitalOcean AI Ecosystem and the DigitalOcean AI Partner Program. The company stated that the additions aim to establish a stronger hub for AI-native startups, technology partners, and systems integrators to develop and scale the next generation of applications. The launch highlights DigitalOcean's effort to combine hardware, advanced models, and developer t",https://finnhub.io/api/news?id=482562aa56e4c76ce8f05c1d38ff8ba90ff2fbf49051b3b00c257dbe2a1cfe31,https://s.yimg.com/rz/stage/p/yahoo_finance_en-US_h_p_finance_2.png,Yahoo,https://finance.yahoo.com/news/digitalocean-unveils-ai-hub-supercharge-131359267.html,https://finance.yahoo.com/news/digitalocean-unveils-ai-hub-supercharge-131359267.html,https://finance.yahoo.com/news/digitalocean-unveils-ai-hub-supercharge-131359267.html,yahoo.com,200,
finnhub,META,2025-10-02T13:09:09,Apple hardware ecosystem safe from AI smart glasses for next 2-3 years: analyst,"Investing.com -- Apple’s hardware ecosystem faces little threat from new AI-enabled smart glasses in the near term, according to Oppenheimer analysts, who argued that key design challenges remain unsolved.",https://finnhub.io/api/news?id=00cc18e1336b7b2dda95e37488851a973dcbbc7db9014784b868c71e232bab31,https://s.yimg.com/rz/stage/p/yahoo_finance_en-US_h_p_finance_2.png,Yahoo,https://finance.yahoo.com/news/apple-hardware-ecosystem-safe-ai-130909907.html,https://finance.yahoo.com/news/apple-hardware-ecosystem-safe-ai-130909907.html,https://finance.yahoo.com/news/apple-hardware-ecosystem-safe-ai-130909907.html,yahoo.com,200,
finnhub,META,2025-10-02T13:00:59,Analyst Explains How Meta (META) AI Investments are Paying Off,"We recently published 10 Stocks to Watch as Investors Scramble to Pour Money into AI Trade. Meta Platforms Inc (NASDAQ:META) is one of the stocks that caught analysts’ attention. Mark Mahaney, Evercore ISI head of internet research, said in a latest program on CNBC that contrary to some reports, several major companies are starting to […]",https://finnhub.io/api/news?id=842639bf528f36e968a4f511d48f9fac8f70cf684b43a3f512dbc7576d24ee12,https://s.yimg.com/rz/stage/p/yahoo_finance_en-US_h_p_finance_2.png,Yahoo,https://finance.yahoo.com/news/analyst-explains-meta-meta-ai-130059852.html,https://finance.yahoo.com/news/analyst-explains-meta-meta-ai-130059852.html,https://finance.yahoo.com/news/analyst-explains-meta-meta-ai-130059852.html,yahoo.com,200,
finnhub,META,2025-10-02T12:18:01,"Dow Jones Futures Fall, Techs Rise With Tesla Deliveries Due; Nvidia Partner In Buy Zone","Stocks rose Wednesday despite a government shutdown, with Nvidia partner Vertiv breaking out. Tesla deliveries are on tap before the open.",https://finnhub.io/api/news?id=f7943ecba869bef6ce264e5e32637b15637b6309088b3bdca9b611ab35e8d4cd,https://s.yimg.com/rz/stage/p/yahoo_finance_en-US_h_p_finance_2.png,Yahoo,https://finance.yahoo.com/m/9e68b540-7c3c-31ba-91c0-0b86b91a98bd/dow-jones-futures-fall%2C-techs.html,https://finance.yahoo.com/m/9e68b540-7c3c-31ba-91c0-0b86b91a98bd/dow-jones-futures-fall-techs.html,https://finance.yahoo.com/m/9e68b540-7c3c-31ba-91c0-0b86b91a98bd/dow-jones-futures-fall-techs.html,yahoo.com,200,
finnhub,META,2025-10-02T12:15:00,The Stock Market Is Historically Pricey: Here's 1 Reason Meta Platforms Is Still a No-Brainer Buy,Investors should always consider buying shares of overwhelmingly dominant companies in any field.,https://finnhub.io/api/news?id=318324a9a393ae38da9f1faa24238bd0aae57578cdea7a9e299d96ea5cce9180,https://s.yimg.com/rz/stage/p/yahoo_finance_en-US_h_p_finance_2.png,Yahoo,https://www.fool.com/investing/2025/10/02/1-reason-meta-platforms-is-still-a-no-brainer-buy/,https://www.fool.com/investing/2025/10/02/1-reason-meta-platforms-is-still-a-no-brainer-buy/,https://www.fool.com/investing/2025/10/02/1-reason-meta-platforms-is-still-a-no-brainer-buy/,fool.com,200,
finnhub,META,2025-10-02T12:10:46,AI Capex Should Cripple Next Profit Cycle For S&P 500,Unsustainable AI-driven capex by big tech may threaten profitability and distort valuations. Read the latest analysis on markets here.,https://finnhub.io/api/news?id=9aad61977056c9c82de5f820c0db07a6b85962f4494b3ac28aef60aea78f7e77,https://static.seekingalpha.com/cdn/s3/uploads/getty_images/2175694227/image_2175694227.jpg?io=getty-c-w1536,SeekingAlpha,https://seekingalpha.com/article/4827492-ai-capex-should-cripple-next-profit-cycle-for-s-and-p-500,,https://seekingalpha.com/article/4827492-ai-capex-should-cripple-next-profit-cycle-for-s-and-p-500,seekingalpha.com,403,
finnhub,META,2025-10-02T10:47:28,"Social Buzz: Wallstreetbets Stocks Mostly Higher Premarket Thursday; Advanced Micro Devices, Opendoor Technologies to Advance",The most-talked-about stocks in the Reddit subforum Wallstreetbets were mostly higher hours before T,https://finnhub.io/api/news?id=316789e1363ab4dc93c8cf3c22a7c233a71900903939f2a502ee8ba246b1e4dd,https://s.yimg.com/rz/stage/p/yahoo_finance_en-US_h_p_finance_2.png,Yahoo,https://finance.yahoo.com/news/social-buzz-wallstreetbets-stocks-mostly-104728996.html,https://finance.yahoo.com/news/social-buzz-wallstreetbets-stocks-mostly-104728996.html,https://finance.yahoo.com/news/social-buzz-wallstreetbets-stocks-mostly-104728996.html,yahoo.com,200,
finnhub,META,2025-10-02T10:00:30,Meta unveils the inevitable turn to AI advertising,"As expected, Meta's AI chatbots are going to be used to tailor its ads. And, not surprisingly, users will not be able to opt out.",https://finnhub.io/api/news?id=0d0883e7c5fd515ca944d0d27a1ef2e40f2532b9a37ccaa1f976c8b0c77a3002,https://s.yimg.com/rz/stage/p/yahoo_finance_en-US_h_p_finance_2.png,Yahoo,https://finance.yahoo.com/news/meta-unveils-the-inevitable-turn-to-ai-advertising-100030202.html,https://finance.yahoo.com/news/meta-unveils-the-inevitable-turn-to-ai-advertising-100030202.html,https://finance.yahoo.com/news/meta-unveils-the-inevitable-turn-to-ai-advertising-100030202.html,yahoo.com,200,
finnhub,META,2025-10-02T09:47:14,CoreWeave: Something Is Very Wrong,"CoreWeave, Inc. secured a $14.2B compute deal with Meta, boosting its stock 15% and diversifying revenue. Click here to read why CRWV stock is a Buy.",https://finnhub.io/api/news?id=a406aedea866feacd6574c3ec1e1d3db619bd1df7827ecdfd1bcce9c6d218219,https://static.seekingalpha.com/cdn/s3/uploads/getty_images/839611330/image_839611330.jpg?io=getty-c-w1536,SeekingAlpha,https://seekingalpha.com/article/4827443-coreweave-something-is-very-wrong,,https://seekingalpha.com/article/4827443-coreweave-something-is-very-wrong,seekingalpha.com,403,
finnhub,META,2025-10-02T09:20:00,3 Red-Hot Growth Stocks to Buy in 2025,Investing in AI leaders could be a smart move.,https://finnhub.io/api/news?id=40b60d897fa7b2fee13009445deba3ece96b7bb861ef5320a1d26cd9c601321b,https://s.yimg.com/rz/stage/p/yahoo_finance_en-US_h_p_finance_2.png,Yahoo,https://www.fool.com/investing/2025/10/02/3-red-hot-growth-stocks-to-buy-in-2025/,https://www.fool.com/investing/2025/10/02/3-red-hot-growth-stocks-to-buy-in-2025/,https://www.fool.com/investing/2025/10/02/3-red-hot-growth-stocks-to-buy-in-2025/,fool.com,200,
finnhub,META,2025-10-02T09:10:00,"Zacks Investment Ideas feature highlights: Constellation Energy, Meta, Arista Networks and Microsoft","AI-driven growth is fueling massive gains, CEG and ANET stand out. META and MSFT continue powering the tech and energy revolution.",https://finnhub.io/api/news?id=abc1a736a41900eef314241759709b56825106d95722f171728a7700861baa71,https://s.yimg.com/rz/stage/p/yahoo_finance_en-US_h_p_finance_2.png,Yahoo,https://finance.yahoo.com/news/zacks-investment-ideas-feature-highlights-091000439.html,https://finance.yahoo.com/news/zacks-investment-ideas-feature-highlights-091000439.html,https://finance.yahoo.com/news/zacks-investment-ideas-feature-highlights-091000439.html,yahoo.com,200,
finnhub,META,2025-10-02T09:00:00,"DigitalOcean Expands AI Ecosystem, Launches Partner Program to Accelerate Innovation and Empower Startups and Builders","LONDON, October 02, 2025--DigitalOcean (NYSE: DOCN), the comprehensive agentic cloud, today announced a significant expansion of its AI offerings within the DigitalOcean AI Ecosystem and the formal introduction of the DigitalOcean AI Partner Program. Unveiled at its Deploy London conference, these initiatives bring together leading technology innovators, systems integrators, venture firms, and AI-native startups to create a comprehensive, flexible, and powerful environment for building the next",https://finnhub.io/api/news?id=ecb318636caab302723505853a6cc265e380d2eb71e0d59c42a7e856ac1b6bdc,https://s.yimg.com/rz/stage/p/yahoo_finance_en-US_h_p_finance_2.png,Yahoo,https://finance.yahoo.com/news/digitalocean-expands-ai-ecosystem-launches-090000117.html,https://finance.yahoo.com/news/digitalocean-expands-ai-ecosystem-launches-090000117.html,https://finance.yahoo.com/news/digitalocean-expands-ai-ecosystem-launches-090000117.html,yahoo.com,200,
finnhub,META,2025-10-02T07:35:00,CoreWeave Stock Soars on $14 Billion Meta Deal -- Wall Street Says the Nvidia-Backed AI Stock Is Still a Buy,"CoreWeave shares surged after the company announced a deal with Meta Platforms, but most Wall Street analysts expect the stock to move even higher.",https://finnhub.io/api/news?id=ea4d75caef06e2a5153cf6addd48278109a070582629217f0008fa59063a5777,https://s.yimg.com/rz/stage/p/yahoo_finance_en-US_h_p_finance_2.png,Yahoo,https://www.fool.com/investing/2025/10/02/coreweave-stock-soar-wall-street-says-ai-stock-buy/,https://www.fool.com/investing/2025/10/02/coreweave-stock-soar-wall-street-says-ai-stock-buy/,https://www.fool.com/investing/2025/10/02/coreweave-stock-soar-wall-street-says-ai-stock-buy/,fool.com,200,
finnhub,META,2025-10-02T04:38:08,2 Mega-Cap Stocks to Keep an Eye On and 1 We Find Risky,"""Too big to fail"" is how we would describe the megacap stocks in this article today. While they will likely stand the test of time, it’s not all sunshine and rainbows as their scale can limit their ability to find new sources of growth.",https://finnhub.io/api/news?id=887601b9c67f8ef2887e6be66252947d79a09e309ee56bb42359bb8423dd8ce1,https://s.yimg.com/rz/stage/p/yahoo_finance_en-US_h_p_finance_2.png,Yahoo,https://finance.yahoo.com/news/2-mega-cap-stocks-keep-043808693.html,https://finance.yahoo.com/news/2-mega-cap-stocks-keep-043808693.html,https://finance.yahoo.com/news/2-mega-cap-stocks-keep-043808693.html,yahoo.com,200,
finnhub,META,2025-10-02T03:40:59,Elon Musk halfway to becoming world's first trillionaire: report,"Billionaire Elon Musk, the world's richest person, is nearly halfway to becoming the planet's first trillionaire, Forbes magazine reported Wednesday. The 54-year-old's net worth hit $500.1 billion Wednesday before dipping back to $499.1 billion, the publication's ""Real-Time Billionaires"" tracker reported.",https://finnhub.io/api/news?id=395f211315efbc4292a0afb7b77b823413a7506b83fc03dae94a65f48d164082,https://s.yimg.com/rz/stage/p/yahoo_finance_en-US_h_p_finance_2.png,Yahoo,https://finance.yahoo.com/news/elon-musk-halfway-becoming-worlds-034059544.html,https://finance.yahoo.com/news/elon-musk-halfway-becoming-worlds-034059544.html,https://finance.yahoo.com/news/elon-musk-halfway-becoming-worlds-034059544.html,yahoo.com,200,
finnhub,META,2025-10-02T03:01:54,"Dow Jones Futures: Stock Market Hits Highs, Tesla Deliveries Due; Nvidia Partner Breaks Out",The stock market rose despite a government shutdown and a weak jobs report. Nvidia partner Vertiv led AI stocks in buy areas. Tesla deliveries loom.,https://finnhub.io/api/news?id=15436dc4ccae425e61b849d52f0d9a478a033863c22d02115296a9e7895b61c5,https://s.yimg.com/rz/stage/p/yahoo_finance_en-US_h_p_finance_2.png,Yahoo,https://finance.yahoo.com/m/9e68b540-7c3c-31ba-91c0-0b86b91a98bd/dow-jones-futures%3A-stock.html,https://finance.yahoo.com/m/9e68b540-7c3c-31ba-91c0-0b86b91a98bd/dow-jones-futures-fall-techs.html,https://finance.yahoo.com/m/9e68b540-7c3c-31ba-91c0-0b86b91a98bd/dow-jones-futures-fall-techs.html,yahoo.com,200,
finnhub,META,2025-10-02T02:58:00,Faraday Future Successfully Concludes FX Super One Co-Creation and Sales Event in Seattle,"Faraday Future Successfully Concludes FX Super One Co-Creation and Sales Event in Seattle Faraday Future Successfully Concludes FX Super One Co-Creation and Sales Event in Seattle, WA. Faraday Future Successfully Concludes FX Super One Co-Creation and Sales Event in Seattle Faraday Future Successfully Concludes FX Super One Co-Creation and Sales Event in Seattle, WA. LOS ANGELES, Oct. 01, 2025 (GLOBE NEWSWIRE) -- Faraday Future Intelligent Electric Inc. (Nasdaq: FFAI) (""FF"", ""Faraday Future"", or",https://finnhub.io/api/news?id=409d850cdc623cf10b7963707cf46cc2458c107295efd49e8f448c4d8d1ab4d8,https://s.yimg.com/rz/stage/p/yahoo_finance_en-US_h_p_finance_2.png,Yahoo,https://finance.yahoo.com/news/faraday-future-successfully-concludes-fx-025800350.html,https://finance.yahoo.com/news/faraday-future-successfully-concludes-fx-025800350.html,https://finance.yahoo.com/news/faraday-future-successfully-concludes-fx-025800350.html,yahoo.com,200,
finnhub,META,2025-10-01T22:45:30,Podcast: U.S. Stocks Climb After Government Shuts Down,Pharmaceutical companies rally on the TrumpRx announcement. Plus: Meta Platforms will monitor users' chatbot conversations to create targeted advertising. ?Listen: Katherine Sullivan hosts the WSJ's Minute Briefing podcast.,https://finnhub.io/api/news?id=a99f9c196b4dd43b7f4480b477590f7c27278101c80228bc92d74a1df015fe01,https://s.yimg.com/rz/stage/p/yahoo_finance_en-US_h_p_finance_2.png,Yahoo,https://finance.yahoo.com/m/f2e9eec5-1a3e-30ef-9b0d-21db92240060/podcast%3A-u.s.-stocks-climb.html,https://finance.yahoo.com/m/f2e9eec5-1a3e-30ef-9b0d-21db92240060/podcast-u-s-stocks-climb.html,https://finance.yahoo.com/m/f2e9eec5-1a3e-30ef-9b0d-21db92240060/podcast-u-s-stocks-climb.html,yahoo.com,200,
finnhub,META,2025-10-01T22:24:26,Apple shelves Vision Pro revamp in pursuit of AI glasses to rival Meta - Bloomberg,"Investing.com -- Apple Inc (NASDAQ:AAPL) is shelving development of a lower-cost Vision Pro headset to prioritize a more urgent initiative: building smart glasses that could rival offerings from Meta Platforms Inc (NASDAQ:META). The company is reallocating internal resources in a bid to gain ground in a growing segment of AI-powered wearables that many in the tech industry view as the successor to the smartphone, according to Bloomberg, citing sources familiar with the matter.",https://finnhub.io/api/news?id=5fc830052eb373cb20a81312e8b68452a461e0aafa5fd2036af9f5d1406117fe,https://s.yimg.com/rz/stage/p/yahoo_finance_en-US_h_p_finance_2.png,Yahoo,https://finance.yahoo.com/news/apple-shelves-vision-pro-revamp-222426801.html,https://finance.yahoo.com/news/apple-shelves-vision-pro-revamp-222426801.html,https://finance.yahoo.com/news/apple-shelves-vision-pro-revamp-222426801.html,yahoo.com,200,
finnhub,META,2025-10-01T21:41:43,"Apple halts Vision Pro overhaul to focus on AI glasses, Bloomberg News reports","The iPhone maker had been preparing a cheaper, lighter variant of its headset, code-named N100, for release in 2027, Bloomberg said.  The $3,499 Vision Pro, launched in February 2024 to heavy fanfare, has struggled to sustain momentum amid a thin slate of mainstream content and competition from cheaper devices such as Meta's Quest.  Apple is working on at least two types of smart glasses, the report said.",https://finnhub.io/api/news?id=e51bd58ad33b8acee9828e3acc000f389df47fb4de2557762cce9db63c924a48,https://s.yimg.com/rz/stage/p/yahoo_finance_en-US_h_p_finance_2.png,Yahoo,https://finance.yahoo.com/news/apple-halts-vision-pro-overhaul-214143343.html,https://finance.yahoo.com/news/apple-halts-vision-pro-overhaul-214143343.html,https://finance.yahoo.com/news/apple-halts-vision-pro-overhaul-214143343.html,yahoo.com,200,
finnhub,META,2025-10-01T21:36:48,CoreWeave (CRWV) Climbs 11.7% on $14-Billion Meta Deal,"We recently published 11 Stocks Crushing Wall Street With Whopping Gains. CoreWeave, Inc. (NASDAQ:CRWV) is one of the top performers on Tuesday. CoreWeave soared by 11.7 percent on Tuesday to end at $136.85 apiece after striking a new $14 billion dollar deal with Facebook owner, Meta Platforms Inc. In a regulatory filing last week, CoreWeave, […]",https://finnhub.io/api/news?id=7f1fd07b9326bbf1ad3a81c70819e8b118db901cf96fe9c9f2662e32cedd57e0,https://s.yimg.com/rz/stage/p/yahoo_finance_en-US_h_p_finance_2.png,Yahoo,https://finance.yahoo.com/news/coreweave-crwv-climbs-11-7-213648190.html,https://finance.yahoo.com/news/coreweave-crwv-climbs-11-7-213648190.html,https://finance.yahoo.com/news/coreweave-crwv-climbs-11-7-213648190.html,yahoo.com,200,
finnhub,META,2025-10-01T21:34:10,Constellation Energy Strengthens Performance with Meta Deal and Share Repurchase,"Constellation Energy Corporation (NASDAQ:CEG) is one of the 12 Set-It-and-Forget-It Stocks to Buy Now. The company gains in monthly performance following the 20-year power purchase agreement with Meta. On August 7, 2025, Constellation Energy Corporation (NASDAQ:CEG) surpassed last year’s second quarter performance with this year’s Q2 GAAP earnings of $2.67 per share and adjusted operating […]",https://finnhub.io/api/news?id=49878c0e1a0316e282e778751ea1849712ba4b4108d835e556a904def7eb1e7c,https://s.yimg.com/rz/stage/p/yahoo_finance_en-US_h_p_finance_2.png,Yahoo,https://finance.yahoo.com/news/constellation-energy-strengthens-performance-meta-213410451.html,https://finance.yahoo.com/news/constellation-energy-strengthens-performance-meta-213410451.html,https://finance.yahoo.com/news/constellation-energy-strengthens-performance-meta-213410451.html,yahoo.com,200,
finnhub,META,2025-10-01T21:10:58,Meta Earns Buy Rating as Strong Earnings Align with Ad-Free Subscription Rollout,"Meta Platforms, Inc. (NASDAQ:META) is one of the 12 Set-It-and-Forget-It Stocks to Buy Now. The company earns a consensus Buy rating amid a strong second quarter and the decision to soon roll out new ad-free versions of Facebook and Instagram. Meta Platforms, Inc. (NASDAQ:META) reported a 22% year-over-year increase in its Q2 2025 revenue, reaching […]",https://finnhub.io/api/news?id=d9b61bf907499ff9a9290bd0431277c9c98c9236f72011178e21f9faedbd2c2b,https://s.yimg.com/rz/stage/p/yahoo_finance_en-US_h_p_finance_2.png,Yahoo,https://finance.yahoo.com/news/meta-earns-buy-rating-strong-211058957.html,https://finance.yahoo.com/news/meta-earns-buy-rating-strong-211058957.html,https://finance.yahoo.com/news/meta-earns-buy-rating-strong-211058957.html,yahoo.com,200,
finnhub,META,2025-10-01T20:35:00,2 Great AI Stocks to Buy in October and Hold for 10 Years,Why investors should buy CEG and ANET now before possible breakouts in October and the fourth quarter. Both AI-boosted stocks are also long-term buy-and-hold candidates.,https://finnhub.io/api/news?id=ccd042cbd302821582309205d10717e943ba4348ab832d3edcf1dc0bd9292700,https://s.yimg.com/rz/stage/p/yahoo_finance_en-US_h_p_finance_2.png,Yahoo,https://finance.yahoo.com/news/2-great-ai-stocks-buy-203500206.html,https://finance.yahoo.com/news/2-great-ai-stocks-buy-203500206.html,https://finance.yahoo.com/news/2-great-ai-stocks-buy-203500206.html,yahoo.com,200,
finnhub,META,2025-10-01T20:33:39,Broadcom (AVGO) Bull Shares His ‘Only Hesitation’ About the Stock,"We recently published 10 Stocks to Watch as Investors Scramble to Pour Money into AI Trade. Broadcom Inc (NASDAQ:AVGO) is one of the stocks that caught analysts’ attention. Tom Hancock, GMO portfolio manager, said in a recent program on CNBC that Broadcom Inc (NASDAQ:AVGO) is a relatively safer AI play because of the company’s diversification. […]",https://finnhub.io/api/news?id=5606b46ace9be3c2547227a4695688e0fe808dff8bd479af6076c6d26898ae55,https://s.yimg.com/rz/stage/p/yahoo_finance_en-US_h_p_finance_2.png,Yahoo,https://finance.yahoo.com/news/broadcom-avgo-bull-shares-only-203339619.html,https://finance.yahoo.com/news/broadcom-avgo-bull-shares-only-203339619.html,https://finance.yahoo.com/news/broadcom-avgo-bull-shares-only-203339619.html,yahoo.com,200,
finnhub,META,2025-10-01T20:30:00,Meta to Announce Third Quarter 2025 Results,"Meta Platforms, Inc. (NASDAQ: META) announced today that the company's third quarter 2025 financial results will be released after market close on Wednesday, October 29, 2025.",https://finnhub.io/api/news?id=251256dd218d5a0e1be712356c8bc3280d9ad907123a468b8e81959bb7492ae7,https://s.yimg.com/rz/stage/p/yahoo_finance_en-US_h_p_finance_2.png,Yahoo,https://finance.yahoo.com/news/meta-announce-third-quarter-2025-203000608.html,https://finance.yahoo.com/news/meta-announce-third-quarter-2025-203000608.html,https://finance.yahoo.com/news/meta-announce-third-quarter-2025-203000608.html,yahoo.com,200,
finnhub,META,2025-10-01T20:28:53,Rick Perry’s REIT Fermi Surges 55% After $683 Million IPO,"Fermi sold 32.5 million shares after pricing them within a marketed range of $18 to $22.  The trading gave the Amarillo, Texas-based REIT, which was co-founded by former US Secretary of Energy Rick Perry, a market value of about $19.3 billion based on the outstanding shares listed in its filings.  The company’s shares debuted on the Nasdaq Global Select Market on Wednesday and are expected to begin trading on the London Stock Exchange on Thursday.",https://finnhub.io/api/news?id=c6b2095cca9b9638fa3fe690659902eb46fee3c93f57c8c081e26ed353e6e31e,https://s.yimg.com/rz/stage/p/yahoo_finance_en-US_h_p_finance_2.png,Yahoo,https://finance.yahoo.com/news/rick-perry-energy-reit-fermi-185402176.html,https://finance.yahoo.com/news/rick-perry-energy-reit-fermi-185402176.html,https://finance.yahoo.com/news/rick-perry-energy-reit-fermi-185402176.html,yahoo.com,200,
finnhub,META,2025-10-01T20:20:00,"These Stocks Moved the Most Today: Nike, Netflix, Fermi, Moderna, AES, Lithium Americas, Sunrun, Corteva, and More",Nike trades higher after the sneaker and athletic apparel company’s quarterly earnings beat Wall Street estimates.,https://finnhub.io/api/news?id=6f5dbb34fdca4091ef3f86a6189a28cc3580cf82103a42749f49ef93744a9269,https://s.yimg.com/rz/stage/p/yahoo_finance_en-US_h_p_finance_2.png,Yahoo,https://finance.yahoo.com/m/69041927-616c-3622-84d4-5e2ddf553d35/these-stocks-moved-the-most.html,https://finance.yahoo.com/m/69041927-616c-3622-84d4-5e2ddf553d35/these-stocks-moved-the-most.html,https://finance.yahoo.com/m/69041927-616c-3622-84d4-5e2ddf553d35/these-stocks-moved-the-most.html,yahoo.com,200,
finnhub,META,2025-10-01T20:16:28,Jim Cramer Was Right About Meta Platforms (META),"We recently published 10 AI Analyst Calls You Should Pay Attention To. Meta Platforms Inc (NASDAQ:META) is one of the stocks analysts were recently talking about. In January, Jim Cramer said during a program on CNBC that he wanted to own Meta Platforms Inc (NASDAQ:META) shares because of the company’s AI capabilities. Cramer said at […]",https://finnhub.io/api/news?id=f539204f7f62de17625b4e98da9b2ac53af02be209c1f10f0a24dd9dc94ff7ba,https://s.yimg.com/rz/stage/p/yahoo_finance_en-US_h_p_finance_2.png,Yahoo,https://finance.yahoo.com/news/jim-cramer-meta-platforms-meta-201628463.html,https://finance.yahoo.com/news/jim-cramer-meta-platforms-meta-201628463.html,https://finance.yahoo.com/news/jim-cramer-meta-platforms-meta-201628463.html,yahoo.com,200,
finnhub,META,2025-10-01T20:15:18,Why Meta Platforms Stock Was Wilting on Wednesday,A rival could be stealing the social media company's thunder in one hot corner of the tech space.,https://finnhub.io/api/news?id=3c81bf3ffd3d46bb8d43a5f111fdbc8364c6bf66e53ef83d430764e69cd9ce0d,https://s.yimg.com/rz/stage/p/yahoo_finance_en-US_h_p_finance_2.png,Yahoo,https://www.fool.com/investing/2025/10/01/why-meta-platforms-stock-was-wilting-on-wednesday/,https://www.fool.com/investing/2025/10/01/why-meta-platforms-stock-was-wilting-on-wednesday/,https://www.fool.com/investing/2025/10/01/why-meta-platforms-stock-was-wilting-on-wednesday/,fool.com,200,
