provider,ticker,published_utc,headline,summary,url_redirect,image_url,source,url_final,url_canonical,url_original,domain,http_status,error
finnhub,META,2025-09-15T21:37:15,Stocks Rally as Bond Yields Fall Before FOMC Meeting,"The S&P 500 Index ($SPX ) (SPY ) on Monday closed up +0.47%, the Dow Jones Industrials Index ($DOWI ) (DIA ) closed up +0.11%, and the Nasdaq 100 Index ($IUXX ) (QQQ ) closed up +0.84%. September E-mini S&P futures (ESU25 ) rose +0.43%, and September E-mini Nasdaq futures...",https://finnhub.io/api/news?id=ad787dfd79fcf79bed1068ce210f8605f577ad41fa92c6ae45b67e4d0f1b33fa,https://s.yimg.com/rz/stage/p/yahoo_finance_en-US_h_p_finance_2.png,Yahoo,https://www.barchart.com/story/news/34819556/stocks-rally-as-bond-yields-fall-before-fomc-meeting,https://www.barchart.com/story/news/34819556/stocks-rally-as-bond-yields-fall-before-fomc-meeting,https://www.barchart.com/story/news/34819556/stocks-rally-as-bond-yields-fall-before-fomc-meeting,barchart.com,200,
finnhub,META,2025-09-15T21:29:02,Broadcom Just Hit New All-Time Highs Again. Where Will AVGO Stock Go Next?,"Broadcom is riding the AI wave and smashing highs. Has this chip stock already peaked, or could the next leg higher come sooner than Wall Street thinks?",https://finnhub.io/api/news?id=b12ff1ed282264241f93bb235bbc1bb6e7323d770d05b72a7034fa1dad57dde9,https://s.yimg.com/rz/stage/p/yahoo_finance_en-US_h_p_finance_2.png,Yahoo,https://www.barchart.com/story/news/34819219/broadcom-just-hit-new-all-time-highs-again-where-will-avgo-stock-go-next,https://www.barchart.com/story/news/34819219/broadcom-just-hit-new-all-time-highs-again-where-will-avgo-stock-go-next,https://www.barchart.com/story/news/34819219/broadcom-just-hit-new-all-time-highs-again-where-will-avgo-stock-go-next,barchart.com,200,
finnhub,META,2025-09-15T21:00:22,Netflix Joins Google On Two Elite Lists. Now The Trial Begins.,"As Netflix stock looks launch a breakout, the streamer joins Alphabet, Amazon and Meta on two noteworthy lists.",https://finnhub.io/api/news?id=1bad3d0f5868682515d1620e211ccc4681d69f4cf6dbd2030be4b1f472b3f28c,https://s.yimg.com/rz/stage/p/yahoo_finance_en-US_h_p_finance_2.png,Yahoo,https://finance.yahoo.com/m/010dcd3c-2b55-3873-b503-6c2949b3c7e2/netflix-joins-google-on-two.html,https://finance.yahoo.com/m/010dcd3c-2b55-3873-b503-6c2949b3c7e2/netflix-joins-google-on-two.html,https://finance.yahoo.com/m/010dcd3c-2b55-3873-b503-6c2949b3c7e2/netflix-joins-google-on-two.html,yahoo.com,200,
finnhub,META,2025-09-15T20:32:00,Tesla Stock Surge Leads to Downgrade. Why Elon Musk Is a ‘Wartime’ CEO.,"FEATURE   Tesla stock shot higher Monday as CEO Elon Musk gets ready for an artificial intelligence “war.”  Shares of the electric-vehicle maker traded as high as $425.70 before sliding back to $407.24, up 2.",https://finnhub.io/api/news?id=64beb96fbbe2be763c54842b220f0f5374259152e78a8b87b3bd6be94411c6d1,https://s.yimg.com/rz/stage/p/yahoo_finance_en-US_h_p_finance_2.png,Yahoo,https://finance.yahoo.com/m/d5de74d3-4046-3e2d-8932-9894be791d94/tesla-stock-surge-leads-to.html,https://finance.yahoo.com/m/d5de74d3-4046-3e2d-8932-9894be791d94/tesla-stock-surge-leads-to.html,https://finance.yahoo.com/m/d5de74d3-4046-3e2d-8932-9894be791d94/tesla-stock-surge-leads-to.html,yahoo.com,200,
finnhub,META,2025-09-15T19:24:00,Nosebleed Valuation: Why Nebius's Microsoft Deal Changes Everything,"With its vertically integrated model, strategic Nvidia partnership, and the recently announced, game-changing contract with Microsoft, Nebius Group has positioned itself as a formidable leader in the AI industry.",https://finnhub.io/api/news?id=a8f83cd9e8650a8d7339a52346dbeaa7a41c1c7fad155ba2bfcd23545b9e1735,https://s.yimg.com/rz/stage/p/yahoo_finance_en-US_h_p_finance_2.png,Yahoo,https://finance.yahoo.com/news/nosebleed-valuation-why-nebiuss-microsoft-182400218.html,https://finance.yahoo.com/news/nosebleed-valuation-why-nebiuss-microsoft-182400218.html,https://finance.yahoo.com/news/nosebleed-valuation-why-nebiuss-microsoft-182400218.html,yahoo.com,200,
finnhub,META,2025-09-15T18:40:18,Meta Platforms (META) Partners With CrowdStrike For AI-Powered Cybersecurity Benchmark Initiative,"Meta Platforms (META) recorded an 8% price increase over the last quarter, amid significant movements in the broader technology market and company-specific events. The company's collaboration with CrowdStrike to launch CyberSOCEval marks an important step in enhancing AI capabilities in cybersecurity. Additionally, the announcement of a cash dividend and their recent joint venture with Reliance Industries for AI solutions signal continued growth and partnership strategies. Meta's expansion...",https://finnhub.io/api/news?id=211b3efe8050bc84192b9755c06d826889d4d4a3e07635e00f4618a4242efdf9,https://s.yimg.com/rz/stage/p/yahoo_finance_en-US_h_p_finance_2.png,Yahoo,https://finance.yahoo.com/news/meta-platforms-meta-partners-crowdstrike-174018640.html,https://finance.yahoo.com/news/meta-platforms-meta-partners-crowdstrike-174018640.html,https://finance.yahoo.com/news/meta-platforms-meta-partners-crowdstrike-174018640.html,yahoo.com,200,
finnhub,META,2025-09-15T17:37:41,Meta Expands WhatsApp Status Ad Options,"Soon, you'll be able to link through to WhatsApp Status promotions.",https://finnhub.io/api/news?id=0d9cb07b57ecac9ee990426b68244033cf203b79fc942cada02b9c51d2cdbfe3,https://s.yimg.com/rz/stage/p/yahoo_finance_en-US_h_p_finance_2.png,Yahoo,https://www.socialmediatoday.com/news/meta-adds-whatsapp-click-to-message-whatsapp-status-ads/760186/,https://www.socialmediatoday.com/news/meta-adds-whatsapp-click-to-message-whatsapp-status-ads/760186/,https://www.socialmediatoday.com/news/meta-adds-whatsapp-click-to-message-whatsapp-status-ads/760186/,socialmediatoday.com,200,
finnhub,META,2025-09-15T16:47:54,"A TikTok Deal Near? Meta, Oracle, Snap Among Stocks To Watch.","TikTok ban could be avoided with deal ""framework,"" U.S. Treasury Secretary says. Meta stock was higher, along with other competitors.",https://finnhub.io/api/news?id=edd4ec13d260d5672ad8d91bc20b99af23e728d071c3413c409b9d038d17e845,https://s.yimg.com/rz/stage/p/yahoo_finance_en-US_h_p_finance_2.png,Yahoo,https://finance.yahoo.com/m/680a86f1-01a4-3a88-8434-d02f9015cd66/a-tiktok-deal-near%3F-meta%2C.html,https://finance.yahoo.com/m/680a86f1-01a4-3a88-8434-d02f9015cd66/a-tiktok-deal-near-meta-.html,https://finance.yahoo.com/m/680a86f1-01a4-3a88-8434-d02f9015cd66/a-tiktok-deal-near-meta-.html,yahoo.com,200,
finnhub,META,2025-09-15T16:46:39,"Rumble (RUM) Stock Trades Up, Here Is Why","Shares of video sharing platform Rumble (NASDAQGM:RUM) jumped 3.4% in the morning session after it gained attention as Vice President JD Vance announced he would be hosting ""The Charlie Kirk Show"" live on Rumble.",https://finnhub.io/api/news?id=42e2db803dbe4fab287bb7f466db6b5d257d41685a6ffd8a2436abf50bc2c44e,https://s.yimg.com/rz/stage/p/yahoo_finance_en-US_h_p_finance_2.png,Yahoo,https://finance.yahoo.com/news/rumble-rum-stock-trades-why-154639085.html,https://finance.yahoo.com/news/rumble-rum-stock-trades-why-154639085.html,https://finance.yahoo.com/news/rumble-rum-stock-trades-why-154639085.html,yahoo.com,200,
finnhub,META,2025-09-15T16:17:00,"Will Mag 7 Stocks Rally Post Fed? What the Charts of Microsoft, Tesla, Meta Say.","This narrow outperformance speaks to broad participation across the technology sector.  Microsoft  the third-largest holding in the  is down 8% from its all-time high after a sharp earnings-related reversal on July 31.  Bulls will take comfort in the stock’s resilience, particularly after the bearish engulfing candle on Sept. 5 failed to gain traction.",https://finnhub.io/api/news?id=e5cc27f7d2494312893ed9b3602c5507874817787440e3f06a4b9a50131b68c1,https://s.yimg.com/rz/stage/p/yahoo_finance_en-US_h_p_finance_2.png,Yahoo,https://finance.yahoo.com/m/a44480f5-474f-383d-bdbb-f292a8e4af35/will-mag-7-stocks-rally-post.html,https://finance.yahoo.com/m/a44480f5-474f-383d-bdbb-f292a8e4af35/will-mag-7-stocks-rally-post.html,https://finance.yahoo.com/m/a44480f5-474f-383d-bdbb-f292a8e4af35/will-mag-7-stocks-rally-post.html,yahoo.com,200,
finnhub,META,2025-09-15T15:55:37,"Jim Cramer Says Amazon.com, Inc. (AMZN) Was Added To Morgan Stanley’s Vintage List","We recently published 10 Stocks Jim Cramer Discussed As He Talked About President Trump & Trillionaires. Amazon.com, Inc. (NASDAQ:AMZN) is one of the stocks Jim Cramer recently discussed. Cramer frequently discusses Amazon.com, Inc. (NASDAQ:AMZN) in his morning show. Most of his comments for the firm surrounding its cloud computing and eCommerce businesses. The past few […]",https://finnhub.io/api/news?id=937c7a5861ede616a3b6d4c03c8843a9c1e2b8571e8f40b887e775d01a36150e,https://s.yimg.com/rz/stage/p/yahoo_finance_en-US_h_p_finance_2.png,Yahoo,https://finance.yahoo.com/news/jim-cramer-says-amazon-com-145537896.html,https://finance.yahoo.com/news/jim-cramer-says-amazon-com-145537896.html,https://finance.yahoo.com/news/jim-cramer-says-amazon-com-145537896.html,yahoo.com,200,
finnhub,META,2025-09-15T15:31:23,Canadian AI firm Cohere targets growth in Europe with Paris office,"PARIS (Reuters) -Canadian AI startup Cohere is expanding operations in Europe, intensifying competition with homegrown players like France's Mistral to supply AI services in the region.  Cohere, which was valued at $6.8 billion in its latest funding round, opened an office in Paris on Monday and is keen to take a bigger share of Europe's growing demand, said CEO Aidan Gomez.  The firm will join others lured to the French capital by French President Emmanuel Macron's push to create a European AI hub in the country, part of a bid to reinforce Europe's digital sovereignty.",https://finnhub.io/api/news?id=581f719fb2d21d8c3897861c87fdbba13044d56932bac2a48a098c2fe860e459,https://s.yimg.com/rz/stage/p/yahoo_finance_en-US_h_p_finance_2.png,Yahoo,https://finance.yahoo.com/news/canadian-ai-firm-cohere-targets-143123893.html,https://finance.yahoo.com/news/canadian-ai-firm-cohere-targets-143123893.html,https://finance.yahoo.com/news/canadian-ai-firm-cohere-targets-143123893.html,yahoo.com,200,
finnhub,META,2025-09-15T15:26:50,Pinterest's AI-Powered Shopping Assistant: Unlocking The Next Phase Of Growth,"Discover why Pinterest (PINS) is a GARP stock with strong growth, AI-powered shopping tools, and global expansion.",https://finnhub.io/api/news?id=b7c9cfbb3555707a5d6ea125b55645f883904a021c6a6da9c8fc4c4efead69e7,https://static.seekingalpha.com/cdn/s3/uploads/getty_images/171363702/image_171363702.jpg?io=getty-c-w1536,SeekingAlpha,https://seekingalpha.com/article/4823070-pinterests-ai-powered-shopping-assistant-unlocking-the-next-phase-of-growth,,https://seekingalpha.com/article/4823070-pinterests-ai-powered-shopping-assistant-unlocking-the-next-phase-of-growth,seekingalpha.com,403,
finnhub,META,2025-09-15T14:45:04,Why Meta Platforms (META) is a Top Growth Stock for the Long-Term,"Wondering how to pick strong, market-beating stocks for your investment portfolio? Look no further than the Zacks Style Scores.",https://finnhub.io/api/news?id=02b552bd199e4190fc1d325ca53b37eff1f6a650f76b49cf358594972b934882,https://s.yimg.com/rz/stage/p/yahoo_finance_en-US_h_p_finance_2.png,Yahoo,https://finance.yahoo.com/news/why-meta-platforms-meta-top-134504750.html,https://finance.yahoo.com/news/why-meta-platforms-meta-top-134504750.html,https://finance.yahoo.com/news/why-meta-platforms-meta-top-134504750.html,yahoo.com,200,
finnhub,META,2025-09-15T14:43:00,Tesla Stock Surges. Why Elon Musk Is a ‘Wartime’ CEO.,"FEATURE   Tesla stock was rising in premarket trading Monday as CEO Elon Musk gets ready for an artificial intelligence “war.” Shares of the electric-vehicle maker were up 6.3% at $420.69 in early trading, while the and were up 0.",https://finnhub.io/api/news?id=350cb9d1e802e4956ea32eb091a92130e12523bf8a1012a3a3e06886d2446251,https://s.yimg.com/rz/stage/p/yahoo_finance_en-US_h_p_finance_2.png,Yahoo,https://finance.yahoo.com/m/d5de74d3-4046-3e2d-8932-9894be791d94/tesla-stock-surges.-why-elon.html,https://finance.yahoo.com/m/d5de74d3-4046-3e2d-8932-9894be791d94/tesla-stock-surge-leads-to.html,https://finance.yahoo.com/m/d5de74d3-4046-3e2d-8932-9894be791d94/tesla-stock-surge-leads-to.html,yahoo.com,200,
finnhub,META,2025-09-15T14:01:29,"Trump announces TikTok deal, impacting U.S. social media stocks","Investing.com -- President Donald Trump announced Monday that a deal has been reached regarding TikTok, causing movement in several U.S. social media stocks.",https://finnhub.io/api/news?id=43103075817ea528169af67aedbe0ab992aeb3ba267d77a0d6c5a8f32c47d4cd,https://s.yimg.com/rz/stage/p/yahoo_finance_en-US_h_p_finance_2.png,Yahoo,https://finance.yahoo.com/news/trump-announces-tiktok-deal-impacting-130129974.html,https://finance.yahoo.com/news/trump-announces-tiktok-deal-impacting-130129974.html,https://finance.yahoo.com/news/trump-announces-tiktok-deal-impacting-130129974.html,yahoo.com,200,
finnhub,META,2025-09-15T14:00:00,"Chatmeter Integrates With Uber Eats, DoorDash and GrubHub to Enhance Multi-Location Restaurant Customer Intelligence","Multi-location restaurants can analyze delivery reviews at scale, transforming customer feedback into competitive advantage SAN DIEGO, CA / ACCESS Newswire / September 15, 2025 / Chatmeter, the multi-location customer intelligence platform, today ...",https://finnhub.io/api/news?id=04d6e6fc69a6e9f11612c35328250b7730a07127b5022a722adb2f483629c7b9,https://s.yimg.com/rz/stage/p/yahoo_finance_en-US_h_p_finance_2.png,Yahoo,https://finance.yahoo.com/news/chatmeter-integrates-uber-eats-doordash-130000479.html,https://finance.yahoo.com/news/chatmeter-integrates-uber-eats-doordash-130000479.html,https://finance.yahoo.com/news/chatmeter-integrates-uber-eats-doordash-130000479.html,yahoo.com,200,
finnhub,META,2025-09-15T13:35:00,FORMER META PAYMENTS LEADER AND GRUBHUB EXEC AKSHAT THANAWALA JOINS CARIBOU AS CHIEF PRODUCT OFFICER,"Caribou, a leading auto refinance platform whose purpose is to give consumers financial freedom to focus on what matters most, today announced Akshatt Thanawala has joined the company as Chief Product Officer. Thanawala was most recently leading the digital transformation of Meta's payment platform, and has held leadership roles at Grubhub, Orbitz, and Expedia. Thanawala, based in Seattle, will report directly to Caribou CEO Simon Goodall.",https://finnhub.io/api/news?id=5f45cba19ec6b6304fd104cd8529307efd7adf2d1573e668ba2f1d0f1cb6243e,https://s.yimg.com/rz/stage/p/yahoo_finance_en-US_h_p_finance_2.png,Yahoo,https://finance.yahoo.com/news/former-meta-payments-leader-grubhub-123500621.html,https://finance.yahoo.com/news/former-meta-payments-leader-grubhub-123500621.html,https://finance.yahoo.com/news/former-meta-payments-leader-grubhub-123500621.html,yahoo.com,200,
finnhub,META,2025-09-15T13:13:00,CrowdStrike and Meta Deliver New Benchmarks for the Evaluation of AI Performance in Cybersecurity,"AUSTIN, September 15, 2025--Fal.Con 2025, Las Vegas -- CrowdStrike (NASDAQ: CRWD) today, in partnership with Meta, introduced a new suite of benchmarks – CyberSOCEval – for evaluating how AI systems perform in real-world security operations. Built on Meta’s CyberSecEval framework and CrowdStrike’s leading threat intelligence and cybersecurity AI data expertise, this suite of open source benchmarks helps establish a new framework for testing, selecting, and leveraging large language models (LLMs)",https://finnhub.io/api/news?id=90c693cd47cd01cc6b40564e6845060970c6d29f7b59544e63a192baf08e14c9,https://s.yimg.com/rz/stage/p/yahoo_finance_en-US_h_p_finance_2.png,Yahoo,https://finance.yahoo.com/news/crowdstrike-meta-deliver-benchmarks-evaluation-121300531.html,https://finance.yahoo.com/news/crowdstrike-meta-deliver-benchmarks-evaluation-121300531.html,https://finance.yahoo.com/news/crowdstrike-meta-deliver-benchmarks-evaluation-121300531.html,yahoo.com,200,
finnhub,META,2025-09-15T13:10:00,Meta Stock Steadies As EU Relief And AI Deal Set Stage For Meta Connect,"Meta Platforms (META) shares are consolidating near $755, as investors weigh regulatory relief in Europe.",https://finnhub.io/api/news?id=22c71b4ee79b6e82a801e3c6771db93488a99599e8b313bde0497714f2b812c1,https://static.seekingalpha.com/cdn/s3/uploads/getty_images/1497139866/image_1497139866.jpg?io=getty-c-w1536,SeekingAlpha,https://seekingalpha.com/article/4823046-meta-stock-steadies-as-eu-relief-and-ai-deal-set-stage-for-meta-connect,,https://seekingalpha.com/article/4823046-meta-stock-steadies-as-eu-relief-and-ai-deal-set-stage-for-meta-connect,seekingalpha.com,403,
finnhub,META,2025-09-15T13:00:00,"Longroad Energy Achieves Financial Close of 1000 Mile Solar, a 400 MWdc Project","Longroad Energy, a U.S. based renewable energy developer, owner and operator, announced today the financial close and recent commencement of construction of 1000 Mile Solar, its 400 MWdc (300 MWac) solar project in Yoakum County, Texas. In late 2024 Longroad finalized a long-term offtake agreement with Meta in the form of an Environmental Attributes Purchase Agreement, which includes a financial settlement arrangement for the entire energy output of 1000 Mile. The project is expected to achieve",https://finnhub.io/api/news?id=1448d55b330ae830c69255413c6b912a241c4e1e369c5dfb42d8a42295bcb8d2,https://s.yimg.com/rz/stage/p/yahoo_finance_en-US_h_p_finance_2.png,Yahoo,https://finance.yahoo.com/news/longroad-energy-achieves-financial-close-120000536.html,https://finance.yahoo.com/news/longroad-energy-achieves-financial-close-120000536.html,https://finance.yahoo.com/news/longroad-energy-achieves-financial-close-120000536.html,yahoo.com,200,
finnhub,META,2025-09-15T12:27:00,OKLO's Tennessee Bet Lifts Hype - But Should Investors Buy?,"OKLO shares jumped 19% after unveiling a $1.68B fuel recycling facility, but years of cash burn and delays leave its lofty valuation in question.",https://finnhub.io/api/news?id=a28bc7dab96c87fad43d56b97e4a65676b583dc22e02ee9027514ee4e56ec321,https://s.yimg.com/rz/stage/p/yahoo_finance_en-US_h_p_finance_2.png,Yahoo,https://finance.yahoo.com/news/oklos-tennessee-bet-lifts-hype-112700490.html,https://finance.yahoo.com/news/oklos-tennessee-bet-lifts-hype-112700490.html,https://finance.yahoo.com/news/oklos-tennessee-bet-lifts-hype-112700490.html,yahoo.com,200,
finnhub,META,2025-09-15T12:06:55,Is Meta Platforms a Smart Play After Meta and TikTok Win EU Legal Challenge?,"If you have ever found yourself wondering what to do with Meta Platforms stock, join the club. Meta is rarely out of the spotlight, and lately, its price movements have left investors debating whether this tech giant is just getting started or setting up for a breather. Over the past year, META shares are up a whopping 42.0%, and the five-year gain clocks in at more than 200%. Even so, it hasn't been a straight shot upward. Just in the last month, the stock slipped 3.8%, following a modest...",https://finnhub.io/api/news?id=b2626f5e57c7407bf0c6a389e2ce58572b87d8d85685fde2f43e6f49b7ceba49,https://s.yimg.com/rz/stage/p/yahoo_finance_en-US_h_p_finance_2.png,Yahoo,https://finance.yahoo.com/news/meta-platforms-smart-play-meta-110655790.html,https://finance.yahoo.com/news/meta-platforms-smart-play-meta-110655790.html,https://finance.yahoo.com/news/meta-platforms-smart-play-meta-110655790.html,yahoo.com,200,
finnhub,META,2025-09-15T11:53:00,"The Zacks Analyst Blog Highlights NVIDIA, Meta Platforms, Alibaba Group and Medalist Diversified REIT","NVIDIA, Meta, Alibaba and Medalist Diversified REIT all topped their industries over the past year, but each faces unique risks despite strong momentum.",https://finnhub.io/api/news?id=b91d595d30a5556a674717a7c4ae027d578796b977bd11e52c548a3494f18f70,https://s.yimg.com/rz/stage/p/yahoo_finance_en-US_h_p_finance_2.png,Yahoo,https://finance.yahoo.com/news/zacks-analyst-blog-highlights-nvidia-105300090.html,https://finance.yahoo.com/news/zacks-analyst-blog-highlights-nvidia-105300090.html,https://finance.yahoo.com/news/zacks-analyst-blog-highlights-nvidia-105300090.html,yahoo.com,200,
finnhub,META,2025-09-15T11:38:28,Oracle: Suspension Of Disbelief,Oracle Corporation's stock price created a parabolic move in one Google search term. Click here to find out why ORCL stock is a Strong Sell.,https://finnhub.io/api/news?id=1ff2b080898124653bf7d416856defe3accc2c890b0c355245420462c8a4795e,https://static.seekingalpha.com/cdn/s3/uploads/getty_images/1789002083/image_1789002083.jpg?io=getty-c-w1536,SeekingAlpha,https://seekingalpha.com/article/4822995-oracle-suspension-of-disbelief,,https://seekingalpha.com/article/4822995-oracle-suspension-of-disbelief,seekingalpha.com,403,
finnhub,META,2025-09-15T11:00:38,'Look outside of the Mag 7': Fed rate cut investor playbook,"The Federal Reserve will make its decision on interest rate cuts next week, on Wednesday, Sept. 17. Markets are largely expecting an easing of monetary policy. Northwestern Mutual Wealth Management chief portfolio manager of equities Matt Stucky joins Opening Bid host Brian Sozzi to discuss how investors should be positioning their portfolios ahead of the Fed meeting. To watch more expert insights and analysis on the latest market action, check out more Opening Bid.",https://finnhub.io/api/news?id=52fb1b3dacae823fdfe744adf0fcdb1731fe0fa78ed2df036c91cbfc213037a5,https://s.yimg.com/rz/stage/p/yahoo_finance_en-US_h_p_finance_2.png,Yahoo,https://finance.yahoo.com/video/look-outside-mag-7-fed-100038493.html,https://finance.yahoo.com/video/look-outside-mag-7-fed-100038493.html,https://finance.yahoo.com/video/look-outside-mag-7-fed-100038493.html,yahoo.com,200,
finnhub,META,2025-09-15T11:00:00,"Disney Ranks No 1. in MBLM's 2025 Brand Intimacy Study, Demonstrating Enduring Bonds with Consumers","Tech brands dominate, and the Tesla brand tumbles. NEW YORK CITY, NEW YORK / ACCESS Newswire / September 15, 2025 / Disney ranks as the No. 1 most intimate brand according to MBLM's 2025 Brand Intimacy Study, a comprehensive ranking of brands based ...",https://finnhub.io/api/news?id=4b9fd087391532b25e63bdb9fabf4dd3cb5a4c9059915f425db3392c28f0522d,https://s.yimg.com/rz/stage/p/yahoo_finance_en-US_h_p_finance_2.png,Yahoo,https://finance.yahoo.com/news/disney-ranks-no-1-mblms-100000904.html,https://finance.yahoo.com/news/disney-ranks-no-1-mblms-100000904.html,https://finance.yahoo.com/news/disney-ranks-no-1-mblms-100000904.html,yahoo.com,200,
finnhub,META,2025-09-15T10:11:00,"Prediction: This ""Ten Titans"" Growth Stock Will Join Nvidia, Microsoft, Apple, Alphabet, Amazon, Broadcom, and Meta Platforms in the $2 Trillion Club by 2030",Oracle is getting rewarded for growing its cloud the hard way.,https://finnhub.io/api/news?id=e632989f7bd86d3be7d932d0b492357a8a592cb289947eaa9323ea1c606c967b,https://s.yimg.com/rz/stage/p/yahoo_finance_en-US_h_p_finance_2.png,Yahoo,https://www.fool.com/investing/2025/09/15/prediction-ten-titans-oracle-2-trillion-2030/,https://www.fool.com/investing/2025/09/15/prediction-ten-titans-oracle-2-trillion-2030/,https://www.fool.com/investing/2025/09/15/prediction-ten-titans-oracle-2-trillion-2030/,fool.com,200,
finnhub,META,2025-09-15T05:38:01,1 Cash-Producing Stock to Own for Decades and 2 That Underwhelm,"A company that generates cash isn’t automatically a winner. Some businesses stockpile cash but fail to reinvest wisely, limiting their ability to expand.",https://finnhub.io/api/news?id=f6a8a0bae2f1943b27f86c06eba3bd411c05db93e921fa04efe89efc3970f3f7,https://s.yimg.com/rz/stage/p/yahoo_finance_en-US_h_p_finance_2.png,Yahoo,https://finance.yahoo.com/news/1-cash-producing-stock-own-043801166.html,https://finance.yahoo.com/news/1-cash-producing-stock-own-043801166.html,https://finance.yahoo.com/news/1-cash-producing-stock-own-043801166.html,yahoo.com,200,
finnhub,META,2025-09-15T03:00:41,Tracking Ron Baron's BAMCO Portfolio - Q2 2025 Update,Ron Baron's BAMCO Inc. 13F portfolio grew to $36.89B in Q2 2025. Check out the top holdings and significant stake increases of the portfolio here.,https://finnhub.io/api/news?id=22368e07374b831e8ce54039e284f113b17a6fad97e544f36731d32d8814a043,https://static.seekingalpha.com/cdn/s3/uploads/getty_images/1056792912/image_1056792912.jpg?io=getty-c-w750,SeekingAlpha,https://seekingalpha.com/article/4822874-tracking-ron-barons-bamco-portfolio-q2-2025-update,,https://seekingalpha.com/article/4822874-tracking-ron-barons-bamco-portfolio-q2-2025-update,seekingalpha.com,403,
finnhub,META,2025-09-14T23:12:12,"Dow Jones Futures: Nvidia, Meta, Tesla In Focus; Markets Want This From Fed Meeting","Dow Jones Futures: Nvidia, Meta, Tesla In Focus; Markets Want This From Fed Meeting",https://finnhub.io/api/news?id=79d5c255347ceb7b74571f867850b71771d6895fddfd733e3b0d3eede12eff95,,DowJones,https://www.investors.com/market-trend/stock-market-today/dow-jones-futures-tesla-soars-elon-musk-stock-nvidia-china-news/,https://www.investors.com/market-trend/stock-market-today/dow-jones-futures-tesla-soars-elon-musk-stock-nvidia-china-news/,https://www.investors.com/market-trend/stock-market-today/dow-jones-futures-tesla-soars-elon-musk-stock-nvidia-china-news/,investors.com,200,
finnhub,META,2025-09-14T19:09:00,This Is What It Costs to Protect Tesla CEO Elon Musk,Tesla disclosed about $3.3 million in security spending for CEO Elon Musk between the start of 2024 through February 2025.,https://finnhub.io/api/news?id=8d147b1ac01d08a99b66be9c2325094e74db798deaac8fcc0d46825deeaa41a3,https://s.yimg.com/rz/stage/p/yahoo_finance_en-US_h_p_finance_2.png,Yahoo,https://finance.yahoo.com/m/2e994004-dfa2-3b9e-b438-564ceef0ce1e/this-is-what-it-costs-to.html,https://finance.yahoo.com/m/2e994004-dfa2-3b9e-b438-564ceef0ce1e/this-is-what-it-costs-to.html,https://finance.yahoo.com/m/2e994004-dfa2-3b9e-b438-564ceef0ce1e/this-is-what-it-costs-to.html,yahoo.com,200,
